"attraction_id","user","rating","review","review_date"
"2085","jane_w","5.0","The amazing humpback. We went out out on Serengeti with Tom on July 20th. What a fabulous experience! Travelled at exhilarating speed to a reported Orca sighting. An hour with many Orcas viewed, Tom managed to get our boat into some superb sighting spots. Then set off in...","July 23, 2018"
"2085","jayson_g","5.0","Saw Orcas, Humpbacks & Even a Sea Otter!. Wow. I'm so glad I did this trip with my son on my birthday! The crew was super knowledgeable and friendly. My biggest concern was sea sickness and I felt great on their big boat the entire time. It was very family friendly. A once...","July 22, 2018"
"2085","jenniea174","5.0","Time and money well-spent: a fantastic tour!. Whale-watching wasn’t on our original itinerary, but when we found ourselves with two days left and nothing planned, we booked a tour. None of us had ever done anything like this so we really didn’t know what to expect.\nWe rode out with Sidney and...","July 20, 2018"
"2085","michael_d","5.0","Fantastic!. A wonderful day on the water with the cruise taking 4 hours and well worth the money. The guides were informative and easy going plus very knowledgeable. The big boat catered for being outdoors and providing indoor shelter and they did everything they could to...","July 14, 2018"
"2085","darrendazler","5.0","Absolutely brilliant . My wife and I recently had an amazing experience with Eagle Wing Tours.\nWe had a morning 10am departure and within no time we were viewing some killer whales. We then moved on and saw a number of humpback whales really close up. We also...","July 13, 2018"
"2085","maxgeorgia","5.0","Fantastic tour!. We had a great experience this morning with this tour. The staff (Tom, Elise, Molly and Captain Dale) were very welcoming, knowledgeable and friendly. We were lucky enough to see 2 pods of orca whales and many humpback whales. We also saw an elephant seal,...","July 10, 2018"
"2085","cindyh281","5.0","Whales Whales Whales. Oh my gosh such a great activity! Dale was THE Best guide ever. We rented his boat for whale watching and at the very first spot we saw whales. He has more knowledge about whales and wildlife than Google. Such a great educator and his...","July 7, 2018"
"2085","peter_f","5.0","wow!. Ok- you expect to see whales. That's a given. But what sets this outfit apart are the Scarab high speed, smooth cruising bullets that get you to San Juan Island, then all the way back to Race Rocks and home again to Fisherman's wharf in...","July 6, 2018"
"2085","tracy_m","4.0","Whales!. Took the newest covered boat for a 4hr tour in June 2018. Saw Humpback Whales and a Minke Whale 'lunge feeding'. It was hard to get any pictures as the whales don't pose for photos. No Orcas on our tour which was disappointing, but we...","July 5, 2018"
"2085","gloria_w","5.0","1st Time Visit to Victoria. Family was in town for a wedding and wanted to go Whale Watching. Our son recommended Eagle Wing Whale Watching. From booking to tour, the staff are so enthusiastic. Got a coupon on line for a discount. Loved the tour. Saw Orcas, Humpbacks and otters.","July 5, 2018"
"2085","sacko2016","5.0","A fabulous day trip to see Orcas!. Having done some whale watching in NZ, we really wanted to see some Orcas. Well we weren't disappointed and caught up with 3 different Resident pods totalling about 55 Orcas. The crew were great and really knowledgeable. The boat was fast and we were able...","July 4, 2018"
"2085","andrea_c","5.0","First-rate all the way!!. This is going to be a little long because I have SO MANY great things to say!!! First, when we scheduled our trip with them they said they would pick us up at the hotel. We didn't expect this and thought it was a convenient...","July 2, 2018"
"2085","amit_a_p","5.0","Family of whales!. After a delay due to strong winds, our group went out yesterday to search for whales. We were well prepared for the initial choppy waters (first 10 minutes) and never felt unsafe. It was so worth going out. We saw a family of four transient...","July 2, 2018"
"2085","happiness757248","5.0","Whale soup!. Wow! We can’t say enough great stuff about our trip. From start to finish Eagle Wing has it figured out. Organized, efficient, great gear & boats and hey, we saw whales. Orcas, both resident and transient, humpbacks, sea otter, elephant seals. Full meal deal.\nOur...","June 29, 2018"
"2085","leetrav","5.0","Best whale-watching tour ever. We live near the ocean in the San Francisco Bay Area and we get out on the bay and ocean regularly. We've seen a lot of whales and other wildlife. But on our trip to Vancouver & Victoria we wanted to take a whale watching...","June 29, 2018"
"2085","torim","5.0","Great staff, lovely boat, lots of wildlife to view!. I chose this company after carefully screening multiple reviews on Trip Advisor. I am confident I made the best choice!!!! We were on the new boat, 'Wild for Whales.' It is the perfect wildlife watching boat. The windows are HUGE and they clean them thoroughly...","June 27, 2018"
"2085","cindyinboise","5.0","Absolutely the highlight of our vacation. Staff and Tour Excellent. I highly recommend Eagle Wing Tours. Staff, Captain and Crew were the best and the whales we saw were amazing. They couldn't have done anything better to ensure such a great whale watching experience.","June 26, 2018"
"2085","saurabh23","5.0","Orcas. Amazing experience. The team was Knowledgeable, passionate and friendly and made great sightings possible. We saw a pod of Orcas. Possibly on the hunt, Elephant Seals, sea otter, bald eagles... Unfortunately no humpback. Overall a great experience. Will do it again!!!!!","June 26, 2018"
"2085","carol_r","5.0","Fabulous day. A great day with the best crew in their brand new boat. We saw humpbacks, orcas and lots of seals, sea lions and bald headed eagles. The marine biologists on board were really good and very knowledgeable. A very memorable day.","June 26, 2018"
"2085","julias43","5.0","Amazing. Seeing orcas in the wild has been on my husband's bucket list forever and we got to do it with Eagle Wing Tours. We went out on the Serengeti speedboat with Dale who is so knowledgeable and full of stories. We saw orcas, bald eagles...","June 26, 2018"
"2085","planotravelingdivas","5.0","Orcas & Humpback Whales in the Wild Where They Should Be. We took my mom to Victoria for her 75th birthday. I thought the thing she would want to see most was Butchart Gardens. I was wrong. She wanted to see whales in the wild. Eagle Wing Whale Watching Tours delivered on this wish. We saw...","June 20, 2018"
"2085","guide202827","5.0","Orcas and Humpback. We had a great time on Wild 4 Whales. The boat is very comfortable and gives great views, and the staff were friendly, knowledgeable, and passionate about whales. We found a pod of transient Orcas and watched them frolic for nearly an hour. On the...","June 18, 2018"
"2085","tajvidy","1.0","Eagle Wing is not my favorite. According to the pictures that the eagle wings had posted on its site, I expected to have an adventurous journey with the killer whales watching tour and I could see these beautiful animals closely. Unfortunately, our boat was always very far from them whereas other...","June 18, 2018"
"2085","opasuzy","5.0","Excellent Tour & Staff. My husband & I thoroughly enjoyed our Whale Watching tour & experience earlier today! The staff, Rod, Darrell, Sydney, Brennen & Alex went above & beyond to ensure that our entire whale watching experience was the absolute Best! Their knowledge & passion was refreshing and...","June 13, 2018"
"2085","nini123117","5.0","An excellent adventure!. This company provides an informative, and fun adventure showing much respect for the eco systems and the creatures living there. Thank you all for a wonderful tour! Highly recommended. This company is running a first class operation!","June 12, 2018"
"2085","karen_h","5.0","Covered Boat and friendly staff...What more could you ask for...oh yeah a Whale!. This family run business has so much to offer. They are environmentally conscience and have a passion for wild life and that is a combination that I love to support.\nWe were able to see a humpback whale close up and personal, when I say...","June 9, 2018"
"2085","quiltingmamma","5.0","A company with a conscience. I like to support companies that support wildlife and the planet. Eagle Wing does just that. It also has a knowledgale and respectful staff team that clearly love what they do. I am a bird watcher, so on the trip they made a point of...","June 8, 2018"
"2085","bernadette_d","4.0","Awesome. We booked prior to leaving the uk, best company when we reviewed these kind of trips.\nWe were looked after from the moment we arrived, and prior to that as we had to change the day due to ferry crossing. Nothing was a problem, really...","June 7, 2018"
"2085","ulli_b","5.0","4 Ever Wild - Semi Covered Whales and Wildlife Tour!. So much fun! The crew was super friendly and knowledgeable, pointing out all the different wildlife as we saw it. We saw 3 Orcas, seals, porpoises, bald eagles, and Ollie the sea otter! The boat was nice and came equipped with binoculars, hats, gloves, etc....","June 5, 2018"
"2085","patricia_n","5.0","Best Whale Watch Tour Ever!. Eagle Wing Tours is a top notch operation! We took a 3 1/2 hour tour. Before we left the dock they assured us we would see the orcas and asked if we could extend the trip if it meant they had to go a further...","June 4, 2018"
"2085","paulm2101","5.0","Great cruise. Really comfortable boat, and a super interesting cruise. Only saw one whale but saw a puffin and bald eagle close up to compensate and loads of sea lions. Wonderful views everywhere.\nNice friendly staff.","June 3, 2018"
"2085","nancyr80","5.0","Fantastic! - Exceeded Expectations. This was the best whale watching tour I've been on. All the staff on board our boat were fantastic: friendly, courteous, knowledgeable, and committed that we have the best possible experience. Not until our tour did I realize that Eagle Wing Tours supports whale research...","June 1, 2018"
"2085","bigstewiesk","5.0","How Eagle Wing Responds to Problems is what Makes them Earn their 5 Stars!. I was waiting for someone else on our trip to write a review but seeing none, I guess it falls on me.\nWe had signed up for an Eagle Wing tour over the May Long Weekend. You can do it in person when you’re there...","May 30, 2018"
"2085","h0ckeym0m511","5.0","Amazing day spent with Eagle Wing Tours. Eagle Wing Tours provided us (my 11 year old and I) with an amazing day on the water with a knowledgeable, friendly captain and crew. The boat we were on was beautiful, safe and well maintained and made the travel on the water comfortable and...","May 22, 2018"
"2085","baddogmikey","5.0","Eagle Wing, the best!. You guys are awesome, friendly, knowledgeable, great service, and all around nice people to spend a few hours with, no whales to see but your encouragement to get the coupon for another trip out FREE, was great. Totally recommend your company in every way!","May 20, 2018"
"2086","robc12222","5.0","Killer Whale-Watching Tour from Vancouver. We did this tour in late July 2018 on on of the Lightship boats, this was a huge amount of fun. You are given exposure suits but still dress warmly, if you are near the rear of the boat you will get wet, but you...","January 21, 2019"
"2086","anne_c","5.0","Very professional and knowledgeable. I have no time for people who complain that they didn't see whales or that they didn't get close enough. It is a privilege to be allowed to see this planet's magnificent creatures and they need to be treated with respect. If you do see...","December 30, 2018"
"2086","clivew1","5.0","Totally Amazing. Very short visit to Vancouver but managed to get a trip out with this Company, helpful all the way through from booking in to leaving the boat afterwards","November 6, 2018"
"2086","samphe","5.0","Great experience. . We booked in advance before coming to Canada on holiday. As it’s nearing the end of the season, we were concerned that we may not get lucky in seeing any whales. However, our worries were unfounded. Within half an hour we’d seen 2 humpback whales....","October 30, 2018"
"2086","neal_w","5.0","Wonderful Time!. We came up from the States and went with some good friends. First hour, we thought, oh this is going to be a bust, and then there where Whales everywhere. We saw Sea Lions, Porpoises, eagles, seals, and much more. Joan was so knowledgeable and...","October 23, 2018"
"2086","renaken","5.0","A Different World!. Highly recommend this Whale-Watching Tour! Friends were coming up from the States with the specific intention of getting out onto the ocean. We chose Vancouver Whale Watch after reading the reviews (and because we’ll take any excuse to visit the beautiful Steveston area).\nFrom entering...","October 22, 2018"
"2086","destination_sun","3.0","Whales!. When dealing with wildlife you need to expect that the guide cannot determine when or if whales will be seen. Having taken multiple whale watching tours I know this to be a reality.\nThis time a choose to take my young niece to experience the...","October 14, 2018"
"2086","nemocardiff","5.0","Fantastic trip and will go again if we return to Vancouver. 11:00am sailing 1 October 2018\nHaving booked the trip online from the UK I was advised by email to contact the office 24 hours before sailing to confirm pickup point and time. Having checked in to our hotel I was about to ask reception staff...","October 11, 2018"
"2086","happyngfamilyholiday","3.0","Been there in Aug. 2018. The advertising pictures can be misleading; i.e. don't expect a jumping whales, and don't expect the whales to be big. They can be big and jumping. With us, whales were less than 10 ft. long, shooting water, watching from far distance. An experience I can...","October 3, 2018"
"2086","boone8","5.0","Excellent experience with a reputable company. Two years ago, my daughter and son in law visited from Ontario and wanted to go whale watching so we booked with Vancouver Whale Watch. During the course of the trip, we saw sea lions, seals, eagles and two humpbacks which were in view for...","September 25, 2018"
"2086","katrinakaposi","5.0","Incredible. I definately recommend this trip. Was incredible to see these gorgeous creatures. Staff were fantastic! Particularly our guide","September 24, 2018"
"2086","707janee","4.0","Super organisation but disappointed not to see whale.. This company is very well organised. The shuttle bus driver was very friendly and made an unscheduled stop on the way back to let us off at Granville Island. We were all kitted out in waterproofs very efficiently and the boat crew was friendly and...","September 21, 2018"
"2086","601cat","5.0","Very special experience.. We had a fantastic few hours at sea on the Explorathor II on a bright, sunny day. We saw resident whales and transient whales and the experience was very moving. Sue, our guide was very informative and Captain Rich took the trouble to explore the...","September 16, 2018"
"2086","donna_r","5.0","Perfect day . So grateful for a beautiful day - saw humpback & killer whales plus sea lions & seals. Staff were friendly & kept us informed along the way. Got picked up & dropped off from hotel.","September 15, 2018"
"2086","worldtraveller1948","5.0","Awesome encounter. Definitely worth taking the shuttle bus, lets you see more of the Vancouver area en route to Steveston harbour, and returns you to the hotel. Well organised trip and protective clothing provided. No catering unless booked. Saw about 11 whales (orcas) after just 30 minutes...","September 15, 2018"
"2086","hjmh1","5.0","Zodiac worth the extra pricetag. Everyone wants to whale watch when visiting Vancouver. This company are very well organised, informative and professional. We chose to go on the Zodiac boat which is a bit more expensive than the large boat. As a nonswimmer and sufferer of seasickness, I was apprehensive....","September 14, 2018"
"2086","kathryn_p","5.0","Pod of Orka, sea lions, seals, porpoises. Went out on zodiac 12 seater open air boat, Took the shuttle from downtown Vancouver with Trevor, he was great and really informative. Went out with Ellen and Carl on the boat, within 10 minutes saw our first porpoise of the trip and sea lions....","September 5, 2018"
"2086","mia328","5.0","Whales, sea lions, porpoises and more!. This was one of the most amazing cruises we have taken. It was a sunny and bright day out and we saw three orcas after only 40 mins. They were swimming close to the shore and we could see them very clearly, quite close by....","August 31, 2018"
"2086","jessie_b","5.0","Best experience . Went on the open air vessel that takes 12people-great experience. Took the shuttle from central Vancouver-timely pickup. Very well organised. Professional and knowledgeable staff. Saw multiple Orcas very active on the surface of the water. Thanks for an awesome trip guys!","August 30, 2018"
"2086","nobu426","5.0","Unforgettable Orca trip!. It was the first Orca watching trip for our family. We picked perfect company!\nQuickly respond for confirmation etc. and The staff, guide and the captain was very friendly and professionals. Especially Mr. Cedric responded very kindly to my daughter who absolutely wants to see...","August 27, 2018"
"2086","u4630qnandyc","4.0","A drive from Downtown Vancouver to Steveston, but great whales. I went out twice, booking well in advance, I was surprised that the trips involved a fairly long drive from Vancouver to Steveston first when there are alternatives that are based in the city. That said, the transfer was included in the price and the...","August 26, 2018"
"2086","f_alice_f","5.0","Highlight of my holiday. We booked a trip in advance, with a shuttle from the city. The driver was really punctual, and everything was very well organised.\nThe boat was comfortable, and well set up. Our ""whale nerd"" Andy was awesome. She just obviously loved the whales and knew...","August 21, 2018"
"2086","isabela_c","5.0","Amazing experience. It helped me realize a little more of my dreams of seeing orcas. The Day allowed only to accompany a family of transient killer whales. But I was treated very well, the guides are great people. Would go back again and again!","August 18, 2018"
"2086","niget1957","5.0","Great experience. We went on the 19 July morning trip. We were picked up at our hotel in downtown Vancouver by a lovely driver called Levi. He gave a well delivered and funny commentary on the way. We were on bigger of the two boats, and everything...","August 16, 2018"
"2086","jon_l","5.0","Great Experience. Everyone was super nice and organized. Andy was a great tour guide with great information. And, we saw orcas and sea lions up close (the orcas actually came up to us closer than this pic).","August 15, 2018"
"2086","linda_a","5.0","Whale watching cruise. Overall a great experience. The shuttle was super convenient and the driver wss entertaining. The tour guide was really knowledgable about the whales and very friendly and approachable. Only caveat - wear sunscreen! I forgot it and was sorry. 😃","July 31, 2018"
"2086","faith_r","4.0","Orca and Assorted other Sights. I went whale watching with this company in mid-July. We had a beautiful day for the trip and it was very enjoyable out on the water. It was great to depart from Steveston as the parking situation and crowds were far less imposing that those...","July 26, 2018"
"2086","emma_d","4.0","Long hunt for orcas but patience bore fruit. We went out on a zodiac boat with our party of eight and this in itself was a great experience - very exhilarating and we needed the thick and warm waterproofs provided. Our captain, Carl, worked hard to find us wildlife in the shape of...","July 21, 2018"
"2086","buddyzach","3.0","Great naturalist, too far from the whales. Andy was a terrific naturalist! Educational, interesting. We saw some orcas, but they were so far away. They were little dots on the horizon. The worst part was there were another 10 boats there and we were by far the furthest. We were told that...","July 8, 2018"
"2086","259lyndseys","5.0","Excellent tour. Really great tour, saw eagles, sea lions and whales. We were out on the water for around 3.5 hours and we were lucky that it was a nice sunny day. Great experience would recommend.","June 23, 2018"
"2086","eyedahoman","5.0","Worth the $$. This was our first time on a Whale Watching trip. We had a great time! We are able to see a small pod of younger Transient Killer Whales. The company scouts before each day to see where the pods might be, which is very nice....","June 20, 2018"
"2086","sarah_w","5.0","Amazing Day. We went on the 17th May and we had a fantastic day with amazing sightings of many Orcas, bald eagles and sea lions. Our guide was brilliant and very informative and the packed lunch very nice.\nThe trip was worth every penny and it is...","June 3, 2018"
"2086","birdy_h","4.0","You need some luck. Long trip, beautiful scenery though. Seemed for a long time we were not going to see any whales but eventually we were very fortunate to see two groups of killer whales, which was an unique experience.\nStill, it may be wise to check the season....","May 2, 2018"
"2086","sanderfase","5.0","Worth watching. Long trip for five hours but in the end were able to spot killer whales. Also spotting birds like bald eagles and sealions. On the way back the sea was extremely bumpy. Not comfortable. But a bit of fun. We had a lovely guide (Ellen)...","April 16, 2018"
"2086","peter_s","5.0","An unforgettable experience.. We went out on April 3rd for nearly 5 hours and had a marvellous time. We Were picked up in Downtown by Ed, a marvellously knowledgeable coach driver and then taken our to Steveston. Customer service was spot on throughout, both on our bus and...","April 3, 2018"
"2086","cpsto2013","5.0","Great whale watching tour. Visited in September. We saw 3 orcas and then the mother load of humpbacks...80-100!\nAwesome service and great sights!","October 21, 2017"
"2086","rootveg35","5.0","Awesome photographic experience. If you want to experience a Whale watching trip when you are in BC this is the best company. Just bring a camera you won't be disappointed.","October 13, 2017"
"2086","kekegram","5.0","AMAZING!!!. Excellent tour and the employees are top notch.\nIt is truly awe aspiring when you get to see these amazing animals up close. The captain did his best to stay the appropriate distance from the whales, but they (at times) had other plans. Our tour...","October 11, 2017"
"2086","andrew_p","5.0","Classy. The Vancouver whale watching team know they run a excellent tour. If your looking for a company that works extra hard for their clients don't hesitate to book. This is a world class operation that goes the extra lengths to make holiday dreams come true....","October 2, 2017"
"2086","alex_t","5.0","Fantastic . So there are a lot of companies that offer whale watching tours, we went for this one because of the facilities it offered and because if you didn’t see whales on your trip they would let you go again for free, return pass is good...","October 2, 2017"
"2086","z5992lmkevinb","5.0","Whale watching. Decided to go whale watching after 3 unsuccessful bear watching sessions in BC and alberta.\nEfficient and friendly booking service, great reception and boarding procedure.\nBoat comfy and very good guide. Found whales half hour out. Had best part of 2 hours watching Orca. Amazing,...","October 1, 2017"
"2086","shellfox24","5.0","Breathtaking experience . I did whale watching with my husband in August and this experience was beyond anything we could have imagined. The staff was very friendly, extremely knowledgeable, and cared deeply to make sure everyone was having a fun and safe experience. The boat ride was very...","September 28, 2017"
"2086","jolow","5.0","Awesome trip. We wanted to do this trip for so long and were not disappointed. The shuttle bus driver was brilliant giving us a commentary about Vancouver on the way there. The sun was shining, all we required was the Orcas to show up. 1 hour into...","September 27, 2017"
"2086","roy_h","5.0","Whales!!!!. We have been on several attempted whale tours in other countries and this was the best. It's not just because we saw whales, which we did, but it's all done very well. Friendly staff, the boat was good, the captain gave us good views of...","September 24, 2017"
"2086","korelios","5.0","Great experience. Booked with the whole family. Luckily great weather and some nice views on whales. Preparation was also very easy and helpful as our father has walking difficulties. Shuttle service with Trevor was great, lots of infos even much better than the city hop-on-hop-off tour. Lunchboxes...","September 22, 2017"
"2086","g1706kqkristinab","5.0","Again a wonderful tour. With my parents visiting from Germany, i booked (once again) a tour with Vancouver Whale Watch. I choose them after previous great experiences and was not disappointed. Though the weather was windy and the sea choppy, we had a great time. A skilled captain kept...","September 20, 2017"
"2086","hollie_r","5.0","BUCKET LIST ITEM!!!. Hands down, one of the best experiences!!\nThe tour company is located in the CUTEST little coastal town....the tour-group has the nicest (and most helpful) staff..... the boat was comfortable, the ride was SMOOTH and peaceful, the scenery was absolutely breathtaking, the seals and porpoises...","September 19, 2017"
