"attraction_id","user","rating","review","review_date"
"2154","cairns4040","5.0","Amazing experience and learned so much from awesome guide. My husband and I have always hesitated to do a tour like this because of concerns for impacts to whales and other marine life however found Eagle Wing tours to be environmental champions for the whales and environment. We learned so much from the professional...","October 4, 2018"
"2154","wanderlusterful","5.0","The only company I whale-watch with!. I've been going out with Eagle Wing Tours for five years now, and they are leaps and bounds above the rest of our local whale watching tour companies IMO. The staff are all highly-educated in our marine life, and the level of information that they...","October 1, 2018"
"2154","westyorkshomebird","4.0","Brilliant. We did this tour at 2:00 in lovely weather. We were out for nearly 4 hours and had a successful trip seeing hump back whales, orcas, harbour and Stella seals and sea lions. We had a brilliant, knowledgeable crew on board our semi covered catamaran....","September 24, 2018"
"2154","sixbakers","5.0","Thank you for an absolutely amazing experience!. We and our four boys (23, 21, 17, 15) set out on Goldwing (crewed by Peter and Melissa) hoping to have at least a glimpse of orca. It was breathtaking to watch a humpback whale within half an hour of leaving the dock. Peter used...","September 4, 2018"
"2154","aknight","5.0","A Breathtaking Must-do!. My family of four (kids age 5 and 8) went on the Wild4Whales boat marine wildlife tour in August and would highly recommend it to anyone visiting Victoria. Truly an AMAZING experience!\nI wasn't sure whether to book an open boat or an enclosed boat....","August 27, 2018"
"2154","bradnjayne","5.0","A great experinece. We booked the cruise that had the cabin and were glad of it. While the company provides jackets, gloves etc it was cold on the water and we were glad of the cabin when in between searcher for whales and other animal life. The crew...","August 25, 2018"
"2154","beck478","5.0","Awesome Orcas. We went on the open boat end June. It was a damp day but we were given everything we needed warm waterproof clothing hats and gloves we needed them but the gear was excellent.\nWithin 10 mins of leaving we found orcas they were fantastic...","July 18, 2018"
"2154","henrique_o","5.0","By far tge best! Shout out to Captain Scotty and Biologist Sidney. Awesome experience! Ask for Captain Scotty and Biologist Sidney! Kindest people out there for whale watching! You basically get a tour throughout the Island and go whale and Bald Eagle watching. Super recommend!","July 11, 2018"
"2154","sophie_p","5.0","The Best In the Industry - Hands Down!. I absolutely love everything that Eagle Wing is doing and is about. The whale watching industry can be a tricky one to navigate for a lot of folks, but as someone who works in the Tourism Industry - I look up to this company very...","July 1, 2018"
"2154","vivian001_12","5.0","Fantastic day out. This is a great day out . The tour guides were really knowable and make the whole day a day to remember. I cannot recommend this enough.","June 25, 2018"
"2154","pat_f","5.0","A Fabulous Trip!. We took our trip in mid-May so it was designated as a Marine Wildlife Tour rather than Whale watching - though it was the whales that we really wanted to see - and we did! We saw two beautiful Orcas, as well as seals, sea...","May 29, 2018"
"2155","pggood","4.0","Great fun for rafting novices. We had a great time with this professionally run rafting tour. Couldn’t have felt safer even when we took a dunk in the glacial water of the Athabasca river. Our daughters loved it. Shout out to Byron who looked after us really well!","July 29, 2018"
"2155","wim4","4.0","Nice ride for a first time of rafting. Organisation is excellent, guides practice security, Jeff was a relaxed guide and told us about the forest, the river and some wildlife. This cat 2+ ride was easy and entertaining.","June 24, 2018"
"2157","the_samsung_g","5.0","awesone time. Rikayla was our kayak tour guide, and we had a blast! loved the details about Vancouver architecture.","July 27, 2018"
"2157","562guilhermel","5.0","Kayak trip -LEME Family . Great time! Thanks Rik for the awesome trip and guided kayak tour.\nWe recommend Water Adventures and the Kayak guided tour.\nBest\nLeme Family","July 25, 2018"
"2157","vic_c","5.0","Great guide, great tour. Absolutely fantastic! We were lucky to have Killian G,. and Alistair O. as our guide. Both are extremely responsible and helpful. We are not avid kayakers at all, but they manage to teach us some paddling skills with a good amount of local information we...","July 13, 2018"
"2158","davidmy8309ov","5.0","Amazing crew, scenery, experience. Brilliant time with the 2:30PM crew today - they looked after us really well, we’re fun to be around and made the experience one of the best on our whole trip. Highly recommend.","June 7, 2018"
"2161","jeff_k","5.0","Great paddle. The paddle in the bay in the afternoon was one of our best kayaking experiences of the trip. The weather was perfect, the guide Mitch was fun and the scenery fantastic.","August 9, 2018"
"2161","uncle_travellin_mat","5.0","Great Afternoon!. We did the 1:00 PM kayak harbour tour. It was a beautiful, calm, warm day. The scenery was amazing, with many cliffs, rock pinnacles, beaches, wildlife, etc... Our guide, Mitchel, was accommodating, professional, knowledgeable, and fun.","July 16, 2018"
"2161","thirstyrobot","5.0","Great tour - with added whales!. This was a great half day tour in two-man kayaks. We started 20 minutes drive down the coast in Trouty and spent 3 hours returning to Trinity; we were lucky to see a bald eagle, arctic terns and a pair of minke whales (which came...","July 13, 2018"
"2162","marcusms5749yi","5.0","Good family activities . A bit rush with 2 hrs trip to Bowen island. Suggest to have at least 3-4 hrs to go further. Originally thought of extend to 3 hrs, but too many bookings occurs.","August 10, 2018"
"2162","m665bcmattp","5.0","Lots of fun. We had a great time on the boat. Saw lots of seals. Then went and cruised around downtown and watched the sea planes take off. Well worth the money.","July 28, 2018"
"2162","corrie_m","5.0","Super Fun and Easy. We rented a boat(East to operate) for 4 hrs. kept it for 7.\nFantastic way to see the area.\nAlso docked at several locations, tied up and went for lunch, as easy as that.\nCan't wait to do it again.","May 8, 2018"
"2162","jack_h","5.0","A Must Do in Vancouver!. Granville Island Boat Rentals is a must do when in Vancouver! It is a fantastic way to see the beautiful scenery that surrounds Vancouver. Whether you're new to boating or a seasoned pro, it is a great way to get out on the water. We...","April 22, 2018"
"2162","chrissb2733ld","5.0","This may stretch you comfort zone but you will love it!. If you miss this you have missed the point of Vancouver. Start with renting a boat over at Granville Island Boat Rentals, then bring the boat around to the market docks, free of charge, and you can moor there while you go inside and stock...","December 15, 2017"
"2163","theresaj854","5.0","Highlight of our trip!. This is a truly different experience that everyone should try at least once in your life! It was so cool! We were all scared, but our guides Sam and Adrian were so patient and supportive that they got us up and flying in no time....","August 25, 2018"
"2163","adf1195","5.0","So much fun!. This experience was one of the coolest things I've ever experienced! Mike and Kevin are excellent instructors and are incredibly knowledgeable! The whole team is committed to making sure you have the best time out on the water! I would 100% recommend this to anybody...","August 14, 2018"
"2163","mricketts","5.0","Amazing Experience. The team was extremely professional, knowledgeable, friendly and made the experience lots of fun. They make you comfortable and break down the process teaching you how to fly. Michael Prince was very patient giving me step by step directions especially with my concerns about being...","August 14, 2018"
"2163","terkatomkova","5.0","Highlight of my summer !!. Me and my brother had an absolute blast today!! I seriously can’t think of a better place to try this out; the staff, Mike and Kevin were awesome, super encouraging and friendly the whole way through! Music on the boat, great shots to remember it...","August 12, 2018"
"2163","adam_m","5.0","Great day to fly. Eye opening experience. Mike, Sam & Kevin were friendly and knowledgeable. Once hitting the water the quick tips helped me. The sensation of flying over the water was amazing. I also loved the dolphin dives. Classy outfit with great equipment. This is a must do...","August 12, 2018"
"2163","carlschmidt","5.0","You need to experience this at least once in your life!. I really can't say enough great things about the folks at Hydrofly Kelowna. From the booking experience to every moment on the water it was clear the whole team is committed to ensuring you have a great time. Props to Kevin and Sam, you guys...","August 3, 2018"
"2163","jane_d","5.0","Super Fun!. The best! - according to our sons. Mike and Kevin were super instructors. Overall a really great experience and the highlight of our visit to Kelowna.","July 22, 2018"
"2163","glenn_a","5.0","Jet-packing is super fun!. My husband and I decided to try jet- packing as part of our 25th anniversary holiday. I was a bit apprehensive, but was assured that it's easier than water- skiing, and you learn at your own pace. Both my husband and I loved our jet-pack...","September 12, 2016"
"2163","mackenzie_j","5.0","Flyboarding lesson. I was in Kelowna for a few days with my roommate and we stopped in at the downtown marina to give this whole fly boarding thing a shot. Honestly the most amazing experience ever. The guys were super helpful and encouraging and wouldn't have changed...","August 19, 2016"
"2163","craig_h","5.0","Got me flying in no time.. I received a lesson for my 40th birthday and had a blast. James was my instructor and he was friendly and knowledgeable. He was able to coach me along and get me airborne, turning and diving and recovering quickly enough that I had plenty of...","July 29, 2016"
"2166","john_c","5.0","Mix-up turns out fabulous. We had a bit of a mix up with our reservation but Marie at Mont Tremblant Activity Centre, with her amazing people skills, took great care of us and we left for our trip the next day. It is about a 60 to 70 minute...","August 25, 2018"
"2171","johnny_x","5.0","Great first family rafting trip. Rafting on Toby Creek was a great first time experience. Right at the adventure center in Panorama, the venue was very easy to get to. Mitch, our guide, was very friendly prior to the start time, and went through all the information we needed before...","August 29, 2018"
"2171","622artr","5.0","Awesome trip . For a first time white rafting trip, this was awesome.\nEven though it was almost a month ago, I still can't stop laughing for the good the times we had.\nThe rafting is fairly easy (especially high summer.. After not having rain in a few...","August 27, 2018"
"2171","red_w","5.0","Do it. Went for a corporate team building event - we had about 8 of us in one raft. It was a great activity and would highly recommend this for business or pleasure and all age levels. Staff was professional and confidence inspiring but also laid back...","August 27, 2018"
"2171","huculak_s","5.0","Great Experience. We went rafting on Toby Creek with our children aged 8 and 12 and had a blast. Our guide, Mitch, was very knowledgeable and made the trip even more fun with great stories and expert navigating. We highly recommend this trip for young families. It...","August 24, 2018"
"2171","jappe_k","5.0","Perfect first-time Rafting for our 9 and 11 yo kids, great team !. I would definitely recommend this to families with kids under 12 !\nThis was the perfect first-time Rafting experience for our family, including our 9 and 11 yo boys.\nVery well organised, good equipment, clear safety instructions, with a twist and some wel placed jokes...","August 23, 2018"
"2171","tamara_h","5.0","Toby Creek Run. I'm almost 50, and not super active, so was a little nervous about trying this, but I was travelling with 3 teenagers (a 15-year-old and two 19-year-olds) that were excited to try white water rafting, so I sucked it up, and booked us a run....","August 22, 2018"
"2171","ornit_h","5.0","Excellent experiance. Andrew the raft guide was skilled, nice and patiance with our novice party. The whole experience was manadged efficiantly and skillfully by the polite staff, from signing the waivers through fitting of boots, wetsuit and helmet, storing and locking our towels and keys, bussing us...","August 19, 2018"
"2171","dxanderson","5.0","Great guides - great trip..!. Fantastic experience beginning to end - Tara and Charlotte went out of their way to help arrange our trip and Zach was an amazing guide. It was the first rafting trip for our 12 year old daughters - they loved it..!","August 16, 2018"
"2171","kerrieannl2018","5.0","Incredible experience, would highly recommended!. We had originally booked the Kootney trip, but due to the fires had to change. The girl who phoned me (Terra - sorry if spelt wrong) to inform me that they could not offer the Kootney trip was extremely kind and helpful. My family had...","August 15, 2018"
"2171","fcundlehuddy","5.0","Fantastic Experience . We absolutely loved the Toby Creek whitewater rafting - perfect for teenage girls (and the 2 adults as well)!!\nMitch was a great guide...very safety conscious and made the trip a thrilling experience. The views are spectacular!!","August 14, 2018"
"2171","britfamily38","4.0","Fun for all of the family. We went rafting on the Kootenay River as a group made up of two families and this was just the right level for younger children and novice rafters. The rapids were not too challenging and we had fun water fights with other rafts. Our guide,...","August 10, 2018"
"2171","terpluvin","5.0","AWESOME experience - highly recommended!. My cousin and I went here for our first whitewater rafting experience. We were a tad nervous but the ~5 guides immediately put us at ease with their kindness, knowledge, silly jokes, and skill! We had 100% confidence that our guide, Zach, would get us...","July 28, 2018"
"2171","dominic_myriam","5.0","Perfect for rookies!. We were a group of 6 rookies with no rafting experience and had an absolute blast! The two hour trip down Toby Creek was a perfect length for a first experience and our guide Mitch was knowledgeable and entertaining. Really a great time! Almost signed...","July 25, 2018"
"2171","hfowler2018","5.0","Perfect rafting river in beautiful Panorama BC. We had so much fun. The employees really made the difference. Scenery was lovely, learned a lot from our guide, Graham. Awesome family experience","July 24, 2018"
"2171","477jasonk","5.0","Always fun. Wow another great trip with Kootenay River Runners!!!!! My wife and I have tagged all three rivers with Kootenay River Runners and what a great group of people.\nAll three rivers have their special point and all three rivers were fantastic.\nToby Creek was the...","July 20, 2018"
"2171","peterp3764","5.0","Toby Creek - Great Starter!. I took my 9 year old, and my father in law on this trip. All three of us had no experience with rafting. All three had a great time.\nErin (not sure i spelled that properly) was our guide and she was super fun and...","July 18, 2018"
"2171","fern_c","4.0","River Rafting the Toby River!. This was the first time for myself and my family to enjoy white water river rafting.\nThis was a fantastic experience for me and my family. We talked about it for the rest of the day and I’m sure it will lead to future legendary...","July 17, 2018"
"2171","davo1234999","5.0","Nice trip but no too adventurous. Had a nice 1 1/2 hours on Toby Creek. Mitch, our guide was great. He and the others made it an very enjoyable. The river was mostly Class II and only two of the rapids were very exciting. It was scenic and fun, but if...","July 16, 2018"
"2171","shawna_l","4.0","First rafting experience. My son and I rafted Toby Creek on a nice, hot day in July. The guides were friendly and knowledgeable. This was a great first-time river to be on as it is not too challenging. We discovered we love it, and want to do another,...","July 11, 2018"
"2171","waterzj","5.0","Great Rafting and Well-run Excursion. Everything was well organised and executed safely.\nHad a great time on the water and the people were great. Shout out to our guide (Andy) for making the trip a blast!","June 23, 2018"
"2171","brittany_n","5.0","Amazing experience!. This was a great tour from beginning to end. We were provided with wet suits, shoes, and helmets and then we were off in the bus to our destination about 10min away. Our guide MITCH was terrific, funny and informative he made us all feel...","June 21, 2018"
"2171","ewalk17","5.0","Family of 5. . Great trip down the Tobey creek. All the employees were super friendly and fun ! Mitch was our guide and did a super job! We took our 3 girls for the first time 13, 10 & 8 years old. Great experience will be definitely coming...","June 18, 2018"
"2171","canadianteacher1","5.0","Toby Creek Whitewater Rafting . Went whitewater rafting today (Aug 15) with our 9yr old on Toby Creek. All necessary equipment provided by Kootenay. All the staff were fun with a collective great sense of humour. Our guide/boat leader Kurtis was fantastic. I would highly recommend him and Kootenay River...","August 15, 2017"
"2171","brad_b","4.0","Whitewater-rafting Toby river. We whitewater rafted Toby creek Aug 19 2016, it is a class 2 rapids not a class 3 in mid Aug, the guides were good and the trip is great, I would recommend the trip to anyone with a family.","August 21, 2016"
"2172","sjfoley01","5.0","Unforgettable experience!. Unforgettable experience! A group of 7 of us did a half-day tour on Anderson Lake as part of a stag trip. Our guides Brad and Geoff were amazing. They put us on the fish immediately and made sure we did everything correctly to ensure we’d...","August 6, 2018"
"2174","omar_s","5.0","Amazing Rafting Experience with Canadian Outback Co!. Our family did the Elaho Exhilarator in 2 groups on 1st August & 2nd August. It was one of the best experiences of our lives!! Thank you Steve for driving us to Squamish & then the river. Out on the river our guides were Jordan...","August 15, 2018"
"2174","lindsit","5.0","Another terrific day with the Canadian Outback Rafting group!. A year ago I rafted the Elaho & Squamish rivers as part of my sister's 40th bday weekend and this time I brought my family back! Husband, 14- and 16-year-old all had a great time! The guides are so friendly and helpful. They're incredibly knowledgeable...","August 14, 2018"
"2174","ilona_l","5.0","Awesome Experience. Canadian Outback Rafting run an amazing trip to the Elaho River... it certainly was exhilarating! Our guide Monique was excellent and gave us brilliant instructions on how to navigate the rapids safely. We all felt like professional rafters by the end! The whole team was...","July 31, 2018"
"2174","alba_hendersons","5.0","Amazing scenery and rafting experience. Big shout for Steve our driver who dealt with a blown tyre on the main bus without batting an eye, then was a source of some great local info on the shuttle bus back to Whistler.\nThe rafting was brilliant, with our guide Cole doing...","July 12, 2018"
"2174","jason_j","5.0","Exciting and fun, a little scary, with beautiful views of nature! Such an adventure, loved the rafting!. Rafting was one of only two MUST DO experiences we had planned for our June 2018 mini-Whistler family vacation. Once I saw videos of the Wet & Wild Elaho Exhilarator trip offered by Canadian Outback Rafting I knew we had found our white water rafting...","June 25, 2018"
"2174","claran0rmand1","5.0","Perfect trip!. The entire experience with COR was awesome. Between the friendly pick-up at the hostel in Whistler and the entertaining bus ride to the river, all this traveling time seemed like nothing. The guides made sure everybody was comfortable and felt safe about the rafting experience....","May 30, 2018"
"2174","jodie_h","5.0","Beautiful Scenery. Matt was a great rive guide, he was so knowledgeable and told us some cool stories. He made the more tamer sections of the river still really fun by getting us to hop in the water or try balancing on the front of the boat....","May 15, 2018"
"2174","dayna_k","5.0","amazing fun. Our guide Pincho and the rest of the team were amazing! it was such a well done tour with such a good crew! hats off to the boys!","May 14, 2018"
"2175","a_s","5.0","Awesome adventure while in Whistler!. I booked this for our annual family adventure. Of our three girls (ranging 11-24) the older two had experience with rafting, but the little one didn't, so the 5 of us opted for the Cheakamus excursion, which we were told was a level 2 river....","September 3, 2018"
"2175","livinginmongolia","5.0","Fun family day out. We had an excellent time. Our group was made up of 2 boys of 10 & 7, my husband and I and my husband's mother.\nWe had a wonderful time. Our guide Ben was excellent value with a good sense of humour. We were a...","September 1, 2018"
"2175","dmitry_r","5.0","Amazing and fun experience!. The entire excursion was very well organized from hotel pick-up to drop-off. The staff was professional and friendly. We had an amazing day on the river!","August 25, 2018"
"2175","ctbehling","4.0","Great teenagers outing. . Booked this for my 4 boys age ranging from 25 to 15. The feedback from them was overwhelmingly positive and the only reason they didn’t give it 5 stars was that the rapids were not fast enough ! There has been a drought in BC...","August 20, 2018"
"2175","ladywig2017","5.0","So much fun! And inclusive!. We took the Cheakamus Family Splash rafting trip with Canadian Outback Rafting and it was absolutely fantastic! They picked us up in Whistler in a comfortable travel van and returned us quickly after the trip was done. The team was incredibly well organized and got...","August 17, 2018"
"2175","hbljbl","5.0","Great trip. The whole family had a great trip with great guides. The kids enjoyed the experience and the friendly guides.","August 5, 2018"
"2175","maxie_w","5.0","Awesome experience . Our guide josh was incredible and made it an amazing experience. The rapids were medium sized and fun, we felt safe the entire time. The gear was great and kept us warm, can’t wait to come back!","July 7, 2018"
"2175","jason_t","5.0","Great trip! . This was $20 cheaper per person than white water rafting trips out of Whistler. We stayed in Whistler but they also offer free pick up and drop off from points from Whistler and Whistler Creekside. Our 7 year old’s first trip and he loved it,...","July 5, 2018"
"2175","ross_a","5.0","White-Water Rafting. Went we two of my buddies, we are all young guys in our 20's who have never rafted before. We had an excellent experience with our tour guide Sam and would heavily recommend this to adventurous youth looking for an excuse to go outside.","July 1, 2018"
"2175","karyn_h","5.0","WHITE WATER FUN. This was the best decision we made! This was our first time on a rafting tour and we were a bit nervous, especially since our son was not on board with the idea. (no pun intended) He was really anxious but once we met Leon,...","June 27, 2018"
"2176","justin_w","5.0","Don't hesitate - book now, you won't be disappointed!. Would give 10 stars if I could! It was my first time ever white water rafting and thanks to this experience, definitely won't be my last! Whole staff was very friendly, professional, and could tell they took safety very seriously - Jordan was our tour...","August 14, 2018"
"2176","lrusanowski","5.0","White water rafting on Vancouver vacation . We had a blast on this trip. Matt was an amazing guide. Thank you Canadian Outback Rafting for a great day!","July 27, 2018"
"2176","michael_h","5.0","Great day out. Pick from Vancouver was perfect and driver very good to chat to the drive.We felt at ease with the reception briefing and Max took great care of us in the raft and gave an interesting and informative chat about different features of the trip.The river...","July 19, 2018"
"2176","wattsup70","5.0","Great day. We had a great afternoon trip on the Squamish. Monique was a fantastic guide and gave us a lot of history in between the rapids. The scenery was amazing.","July 17, 2018"
"2176","dan_c","5.0","Amazing. Had the best time as a first time rafter, the crew are super helpful and fun and the rafting is fun and provides some amazing views highly recommend","July 10, 2018"
"2176","victoria_r","5.0","Perfect day on the river!. My 19 year old son and I did the Wet & Wild Elaho Exhilarator during a ten day action packed high adventure trip. We kayaked through Alaskan glaciers, hiked glaciers, ice climbed, helicoptered out to dog sled in the ice fields, snorkeled with killer and...","June 23, 2018"
"2176","rachelallayne","5.0","Amazing Day on the River!. My boyfriend and I were fortunate enough to enjoy a beautiful, hot, sunny day whitewater rafting with Canadian Outback Rafting. We were picked up in Vancouver at 7:30am where we began the scenic drive to Squamish. There, the adventure began! It started with a bus...","June 5, 2018"
"2178","elizricke","5.0","Awesome day trip! . 6 adults and one 8yr old, saw tons of whales on the way down and loved the seaplane back. Fun time in Victoria, we had a yummy brunch at Jam and then went to Pedaler to rent bikes and do the scavenger hunt. Next time...","July 4, 2018"
