"attraction_id","user","rating","review","review_date"
"2090","oobie_w","5.0","Great fun. Excellent afternoon for two novice rafters. Robert and his team created a very relaxed atmosphere whilst still being very well organised and safety conscious. Just enough excitement without being scary. Highly recommended","July 27, 2018"
"2090","90markusw","5.0","Cool Experience. It was really tough, but absolutely worth it!!! Once you are on the water, (or in) its a different world. Great guidance and a lot of additional info about and around the river complete this cool trip.","July 26, 2018"
"2090","patricia_s","5.0","Fun rafting adventure. We had an excellent ride on the Clearwater river with our guide Robert, full of good explanations on the natural habitat of animals, the geology of the region, and last - but not least - how to properly (and safely) raft. An enjoyable journey for...","July 19, 2018"
"2090","skonkwurks","5.0","Great Adrenaline Rush!. My girlfriend and I chose Riverside Adventures to get a close-up glimpse of Wells Gray Provincial Park as part of our West Coast Trip through Alberta and BC. The rafting experience was very fun for my girlfriend (2nd time rafting) and I (1st time) and...","July 15, 2018"
"2090","jennifer_m","5.0","Amazing experience!. I can’t say enough about the genuine friendliness and expertise of Robert and his wife (sorry, I’ve forgotten your name!). We had our 8 year old son with us and I was a little nervous about the intensity of the river, but it was quickly...","July 13, 2018"
"2090","kail_g","5.0","Amazing time with Riverside Rafting. Everything that you could possibly need was provided. I came into the day a little nervous about whitewater rafting, especially as I came solo, but Robert was an amazing host. He explained everything with great detail and knowledge and made sure everyone felt safe and...","July 10, 2018"
"2090","francesstafford","5.0","Fun for all on a hot day. Great fun on the river, incl rafting the rapids, swimming, hiking to waterfall, diving into base of falls:\nA wonderful experience for young & young at heart.","July 5, 2018"
"2090","craig_d","5.0","Exhilarating trip down the Clearwater River. If you only do one ""action"" activity whilst in Canada, do this one. The Clearwater is a great river to raft on and Robert was an excellent guide. Then after your trip go and see the Wells Gray park waterfalls to see where all that...","June 20, 2018"
"2090","fcevans","5.0","Great Rafting Trip in the Clearwater. Robert was a great host, and we had a fantastic rafting trip with him. We had planned a scenic raft trip, but he suggested the river was well suited to whitewater rafting by the time we had arrived, which we agreed to, and it was...","June 10, 2018"
"2090","alishariat81","5.0","great guide and fun experience..highly recommended. Robert/Liana and Louise (the dog), My wife and I took rafting trip a week ago with you guys. It was a great experience and just wanted to thank you for a great job you did. We loved it. It was our first experience of rafting....","May 25, 2018"
"2090","katrienmoors","5.0","Rafting tour . We went on a rafting tour with a total group of six persons. Robert was our guide. His enthousiasm and his passion was really inspiring!! We really loved this tour. You get worth for your money!! You won't regret rafting with this company! Thanks again,...","May 2, 2018"
"2090","tim_h","5.0","Raise your paddles for the best rafting adventure in town!. Sometimes you happen to be in the right place at the right time. A sunny Friday in Clearwater saw my partner and I lucky enough to be the first rafting guests for the 2018 season and what a spectacular trip it was. Robert has such...","April 29, 2018"
"2090","johngbr-61","5.0","Excellent, well guided trip.. Robert & Liana clearly love their work and have a great understanding and care for the wilderness in which they are so fortunate to live. The rafting trip is well organised and safe, with the dog along to comfort any slightly nervous passengers.\nRobert is...","October 18, 2017"
"2090","westcoastvoyageur","5.0","Brilliant river and mtn experience away from the mad crowds of Whistler and tourist traps!. Late August. We are from Vancouver Island doing an interior tour, trying to escape the high end hype of Whistler.\nWe just spent an unforgettable three days with Riverside hosts in Clearwater. First, we found the river to be one of the most pristine, gorgeous...","August 31, 2017"
"2090","iristravelgirl","5.0","Best Rafting in Clearwater!. Whatever the month I Amin Clearwater, rafting is one of my favourite things to do! And Riverside Adventures is my ' clear' favourite. The guides are knowledgable and very safety conscious, and they know the rivers very well!","August 28, 2017"
"2090","ingrid54_11","5.0","Best afternoon ever!!. On a very short notice we booked the rafting trip and did it this afternoon. Amazing time had by all!!!\nOur grand children are 10 and 13 years old and they had the time of their live. Robert was very patient and helpful. We all...","August 8, 2017"
"2090","doeby-louis","5.0","North Thomson River Rafting. As due to the bush fires the Wells Gray parc was still closed the Clearwater river was unfortunately still closed. We (2 adults and 2 young teens (11/12) were guided to the North Thomson river. No punishment apart from a slightly longer approach to get...","August 3, 2017"
"2090","d'arcy_f","5.0","Superb adventure!. I was in Clearwater late May, early June on a mediation retreat and my adult son accompanied me to do some river rafting. We stayed at Robert and Liana Beaudry's Riverside Cabana which was a perfect little cabin - it contained everything we needed and...","June 13, 2017"
"2090","clare_d","5.0","Great rafting adventure!. We did this rafting trip today and it was brilliant! Robert was great and made it fun and exciting. My 14 year old daughter loved it too.\nWe're staying at the Riverside accommodation too and it's a beautiful place to stay, right by the river....","August 3, 2016"
"2090","murray_a","4.0","Great stay. Stayed at the Riverside Guest suite on the Clearwater River. Very comfortable. Very clean. Very well appointed. Everything from free internet, to a did, cable tv, great sitting areas on the shaded veranda to a nicer tree-lined deck by the river.","June 4, 2016"
"2090","kyle_c","5.0","Fantastic Rafting Experience!. We had a fantastic river rafting experience with Riverside. Robert and Liana are a great team, and took care of every aspect to ensure that we had a great experience. Robert is experienced, knowledgeable, and makes first-timers feel at ease whitewater rafting. We appreciated them...","May 6, 2016"
"2090","richard_o","5.0","""The Best Man on the River"". I overheard Robert being described as such in Clearwater Visitor Centre and can fully endorse this comment. Robert gave my wife, my daughter and I a fantastic rafting experience on the beautiful Clearwater River. He provided an excellent insight into the history and nature of...","October 26, 2015"
"2090","j_q","5.0","Brilliant Fun even if it rains. Never having been white water rafting before I undertook this experience with some trepidation. Need not have worried. Robert and Liana (the owners) run a really professional outfit. The equipment was first class and their knowledge and interesting anecdotes added to the exciting experience. The...","October 7, 2015"
"2090","denise_j","5.0","Lots of pleasure, great tour!. We just really enjoyed the rafting trip with Riverside Adventures. The nature of Wells Grey Park is outstanding as seen from the water. The guides where friendly and gave us a lot of information about the park, its inhabitants (bears) and it's ecological history. The...","August 16, 2015"
"2090","emmagrund","5.0","So much fun!. We just got back from river rafting with riverside adventures. The ride we had booked with another company was cancelled, and then we saw this place - it didn't look as fancy as the other one, but we thought we'd give it a try. And...","August 14, 2015"
"2090","b_n_p","5.0","Scenic White Water Rafting, River Swimming, Jumping off a bridge and showering under a waterfall. Fantastic Fun!. Wow. An Epic Day of Wilderness River White water Rafting, River Swimming/Floating, Jumping off a bridge and Showering under a waterfall not to mention you get to share an unforgettable scenic wilderness river experience with wonderful people out looking for a great adventure just like...","July 30, 2015"
"2090","janni_n","5.0","So much more than rafting - AWESOME. We came to Clearwater in mid/September 2014 and booked the rafting for two days later without any problems. Riverside Adventures was the only company which was still offering rafting trips during that time!!\nWe were a group of twelve People from different countries and were...","September 22, 2014"
"2090","dnaos","5.0","Awesome whitewater experience!. I rafted different whitewater rivers in eastern and western Canada, however Robert's team is absolutely the best. Excellent service with very clear instructions and superb customer service.\nDespite our late arrival in Clearwater, Riverside Adventures Rafting and Fitness Centre was the only company that was...","September 10, 2014"
"2090","846alastairf","5.0","Fantastic Rafting Experience. We have recently returned from our holiday in Canada and one of the highlights of the trip must be the White Water Rafting with Riverside Adventures. The team were fantastic. I had enquired before we left the UK if the experience would be suitable for...","September 1, 2014"
"2090","teresa_o","5.0","Amazing Family Rafting Trip!. We took our family (10, 7, 5 yrs) on a weekend trip to Wells Gray. The tourist info centre recommended a white water rafting trip down the Thompson River with Riverside Adventures. What an amazing highlight of our summer! Rob has 20+ years experience as...","August 24, 2014"
"2090","vdmonds","5.0","First rafting trip a wild success.. We were a little weary going on our first white water rafting experience, but the people at the family-run Riverside Adventures Rafting made us and our son (12) and daughter (15) immediately feel at ease. While clearly looking out for our safety, the raft guides...","August 22, 2014"
"2090","jeff_h","5.0","Excellent Adventure!. This is the most excellent adventure that you can find in Wells Gray Park. My family and friends went on this white water adventure on the August long weekend. We had a fabulous time and will be heading back again next year! Everyone had a...","August 20, 2014"
"2090","tim_h","5.0","Great Family Rafting Adventure. My Son and I went on the Clearwater River with Riverside Adventures this past weekend and we had a blast. They made us feel comfortable right from the start and the rafting was great. The guide was great with the kids on our raft and...","August 15, 2014"
"2090","tafierce","5.0","""Great Experience!"". Come prepared with water shoes or running shoes you don't mind wearing in the water. You can wear sandals as long as they have good straps and have no chance of falling off. There are some used shoes there if you need. Sunglasses must be...","August 10, 2014"
"2090","mark_g","5.0","great time was had by the Graats from London ontario. I would highly recommend riverside adventures and would like to thank the Beaudrys for a wonderful time .Robert and Liana have been doing this for 25 years in this area they no the water and area very well and felt very safe .The rafting was...","August 5, 2014"
"2090","kellyae2014","4.0","Great family fun, but tame for the experienced rafter. If you are looking for a family adventure or haven't rafted a whole lot, the Clearwater River would be great for you. The guides were fantastic, a really nice family run business. Personally I wished there were more rapids and the trip was longer. We...","August 1, 2014"
"2090","sbalorosco","5.0","A great family adventure. We fully enjoyed rafting on the Clearwater river with Riverside adventures, our first rafting experience. We are a family of five with a seven year old boy, and girls of 11 and 16 and this trip was tailor-made for us.\nYou get a combination of...","July 30, 2014"
"2090","drsouthern","5.0","Excellent Experience!. My 10 year granddaughter and I took a white water rafting trip with a group of 6 adults and 6 children. It was a great, safe ride...lots of screams of joy from the little ones. As many others have written, Robert is a great guide...","July 22, 2014"
"2090","925nikim","5.0","Excellent rafting experience!. This was my first ever rafting experience - loved it! I felt safe and very comfortable in the raft - Robert and his daughter's experience and knowledge of the river definitely showed. We enjoyed the hike up to the waterfall and the snippets of information...","July 17, 2014"
"2090","robert_b","5.0","Rafting the clear water river. what a thrill, an amazing way to experance white water rafting in such a beautiful\nplace as Wells Gray Park , a great experance for all ages memories for a life time\nRiverside adventures provided a safe and fun experance ,My wife and all the...","July 16, 2014"
"2090","hayo_s","5.0","the eleven flying dutchmen. on a warm sunny day, we went out for rafting. Two families with seven children between eight and fourteen years. An amazing experience!.\nWe felt safe and comfortable at Roberts' raft. He was very enthusiastic and experienced. We were surprised by his knowledge about the...","July 15, 2014"
"2090","unimog25","5.0","First time rafters. As part of our trip to Canada we decided to have a go at White Water Rafting and chose Riverside Adventures in Clearwater BC as they were a local business recommended by the tourist office. My wife does not really like the water but after...","October 11, 2013"
"2090","whitewaterandpow","5.0","Amazing Rafting and Kayaking!. Robert, Liana, and Michael are an excellent team.\nI came to Clearwater to step up my White Water Kayaking skills and had the time of my life!\nAs I was unfamiliar with the river and a bit unsure I myself, Robert recommended that I do...","August 12, 2013"
"2090","knsparling","5.0","Rafting HIGHLY recommended!. Today (August 8) we took our group of 7 down the Clearwater River. Upon arrival the female owner was very sweet and welcoming and immediately took to our three boys ages 7, 8, 9 to get them geared up while we did the paperwork. Their...","August 8, 2013"
"2090","weikoo","5.0","Guesthouse of Riverside Adventures. Great place to stay. Calm and relaxing. Guesthouse has a very nice deck looking down Clearwater river. Direct access to the river also possible. Guesthouse has everything you need, well-equipped kitchen, BBQ, bathroom, separate bedroom. WiFi much better than in any hotel. Excellent starting point...","August 2, 2013"
"2090","jamie_w","5.0","Another amazing trip!. This trip was my third time on the Clearwater River with Riverside Adventures. They suggested I go on a two-man inflatable kayak and boy was I not disappointed!! These guides are super friendly, super knowledgeable and super professional. Every time I go I come back...","July 29, 2013"
"2090","kenneth_b","5.0","Experience and Professionalism. Nestled in one of the most scenic hideaways in British Columbia's mountainous interior, you will find Clearwater and its friendly locals. One of those places where everybody waves and calls you by your first Name. Famous for its Whitewater rafting Clearwater has a handful of...","September 25, 2012"
"2090","nicole_m","5.0","Had a blast!. We had a fun-filled time with Riverside Adventures Rafting. I was a bit nervous when I booked our rafting trip but am I ever glad we went. It was thrilling but I felt very safe. The staff are very professional and safety aware. The facility...","August 21, 2012"
"2090","tnfcvicciweller","5.0","Fantastic Service & Fun. We loved our excellent adventure whitewater rafting down the Clearwater River in Clearwater, BC with Riverside Adventures Rafting & Fitness Centre! First of all, the rapids were thrilling and exhilerating, Robert Beaudry, owner/operator is an excellent host and guide due to his extensive outdoor adventure...","August 14, 2012"
"2090","roy1960","2.0","Not entirely honest with us. I will start out by saying that everyone at Riverside Adventures was polite and attentive, including the owners, their daughter, who works for them, and our rafting guide. The day we went the river level was too high to safely raft the advertised trip, and...","July 20, 2011"
"2090","yorkshiretraveller12","5.0","Wow - never thought that we would do this. We did this a couple of years ago on a large inflatable with 4 other people on board, you do your own paddling.\nThey are very safety aware and you are fully kitted out with wet suit, life jacket and hard helmet.\nIt lasted a...","October 1, 2009"
"2091","zajmat","5.0","Loved it!. It was our first time canoeing and I was a bit worried before the tour, about the weather and our inexperience. It was a snowy day and Mike started by teaching us some basic canoeing skills. He was very well prepared and gave us blankets,...","October 28, 2018"
"2091","jo_r","5.0","Amazing evening canoe trip!. We went on the evening canoe trip in September and it was honestly one of the best things we did on our entire holiday! We had the entire lake to ourselves which felt so special and allowed us to really appreciate the stunning scenery. Mike...","October 8, 2018"
"2091","nancy_w","5.0","Great trip. Loved it. Mike was a wealth of knowledge and an all around great guy to spend the morning with. He was a welcome addition to our group of six!","October 2, 2018"
"2091","caeleigh_m","5.0","Great Evening Spent on Pyramid Lake. My husband and I did the sunset paddle with Mike on Monday and had an absolute blast. The views were absolutely stunning and Mike was a great host, providing us with baked goods and hot chocolate at a pit stop halfway through. Our boat was...","September 28, 2018"
"2091","418toddw","5.0","Stop. Paddle. Enjoy.. Mike did a great job and we had a wonderful time.\nThe muffins and the hot chocolate would have been the highlight if not for the great views and scenery!\nA great way to spend a few hours while in the Jasper region.","September 24, 2018"
"2091","springychicken","5.0","An amazing experience!. We family of 5 went out with Mike at the end of July 2018 at the very beginning of our amazing 3 week adventure in Canada.\nWe booked a Private Guided Trip on Pyramid Lake for 3 hours. It was stunning!\nMike was brilliant, friendly,...","September 11, 2018"
"2091","helrog52","5.0","Simply Awesome 😎 . We went on the lake at 08.30 this morning with Mike. We had the whole lake to ourselves, just the 3 of us in the wonderful wooden canoe 🛶.\nOn our way to the lake we saw a pblack bear, just amazing.\nMike is a...","September 10, 2018"
"2091","kathy_f","5.0","Jasper Trip Highlight. Definitely recommend this trip! Mike is a fabulous guide. Not only knowledgeable about the lake and the area, but a fabulous host as well. Thank you a beautiful morning on Pyramid Lake!","September 3, 2018"
"2091","jason_l","5.0","Amazing canoe trip on Pyramid Lake. On our last day we went out with Mike for 3 hours on Pyramid Lake. It was a great way to end our trip to the area. The water was beautiful and the views spectacular. Mike is a great guide. He knows a ton about...","August 30, 2018"
"2091","colinakmcintosh","5.0","Treasure this activity. We did a morning tour and had a wonderful time. My wife's first time on a canoe, she was a little apprehensive but the two guys, Mike and Travis were really supportive and quickly put her at ease. The peace and tranquillity you experience, moving...","August 29, 2018"
"2091","marjo7676","5.0","Incredible! Amazing! Absolutely beautiful!. We are a couple that travelled to Jasper on August 2018.\nWe hired a private canoeing in Pyramid Lake, but we never expected how private it will be. The lake was just the two of us, Mike and his great handmade wood canoe and all...","August 20, 2018"
"2091","melina_s","5.0","Fantastic Experience. Pyramid Lake Canoeing Adventure was one of the highlights of our recent road trip in Canada. We were picked up from our hotel by Travis who was our guide for the morning. He was excellent throughout. He was extremely knowledgeable about the lake and the...","August 3, 2018"
"2091","sarah_g","5.0","Cherry on top! . This was our last tour on our last day in Jasper and it truly was the cherry on top! We packed a lot of adventures into our 3 day trip to jasper this was by far our greatest experience. We ended up getting a private...","August 3, 2018"
"2091","brandy_m","5.0","Serene . An awesome excursion! Mike was very knowledgable, friendly, and took great pics of us as we paddled. He was very prepared for any weather and the baked goods and cocoa were delicious. I would definitely do this again.","August 2, 2018"
"2091","amy82371","5.0","DO THIS TRIP!. So far this may possibly be the highlight of our Canadian adventure! We met Mike at 6 PM at the dock in front of Pyramid Lake resort. He was very welcoming and gave us quick instructions before we set out. We practically had the lake...","July 25, 2018"
"2091","michael_h","5.0","A Jasper must do. 👍 . Awesome morning on the canoe with Mike. We booked the day before via telephone. Mike met us at the rv Park in Jasper and was delightful with our family from start to finish. He was fun, knowledgeable and a lovely chap to canoe with. He...","June 16, 2018"
"2091","christianlj7522vb","5.0","Great time with Mike! . We did go on a 3 h trip with Mike yesterday. It was great and lots of fun canoeing with him.\nHe is very knowledgeable about the wildlife, landscape and history.\nHighly recommended tour for an adventure on the lake.\nKathi and Christian","May 16, 2018"
"2091","getaway691954","5.0","Amazing experience! . My friend and I had an amazing time on our canoe trip with Mike! There were tons of thoughtful touches like drinks and snacks, and Mike told us a bunch of interesting information about the area. He gave us lots of tips to improve our...","May 15, 2018"
"2091","743raffaelad","5.0","Canoeing with Mike, the perfect guide and host. We went canoeing at Pyramid Lake back in October and had an amazing time. Our guide Mike was super friendly and the perfect host. He completely pampered us with cosy blankets, mittens, tea, coffee and home baked cakes! Canoeing on the lake was a super...","January 29, 2018"
"2091","kristin_r","5.0","HIGHLY Recommend Pyramid Lake Guided Canoe Tour. We had a truly fantastic experience with Mike at Wild Current. I highly recommend Wild Current's guided canoe tours and am so glad we booked this while we were visiting Jasper. Our tour was in Sept 2017, and the weather was a little unpredictable, but...","October 11, 2017"
"2091","tracy_n","5.0","Absolute must do!. This was a highlight of our time in the Canadian Rockies. We had a morning canoe adventure with Mike on Lake Pyramid on October 1st. A cool morning, but Mike came equipped with extra blankets and mittens. Simply amazing scenery. We stopped for a short...","October 4, 2017"
"2091","jenny_n","5.0","Fabulous afternoon paddling Pyramid Lake. We spent the afternoon paddling a large wooden canoe with another couple and our guide Mike. Great experience on the lake and delicious afternoon coffee and tea break with yummy snacks. Saw a muskrat and lots of birds. Highly recommended.","October 2, 2017"
"2091","kyliee440","5.0","A gorgeous morning . We went out on a morning canoe tour with Mike. We had a lovely fall day, but even without the perfect weather it would have been a wonderful trip.\nThe canoe was comfortable and it was fun learning to paddle (though you could just sit...","September 28, 2017"
"2091","robbobristol","5.0","An unforgettable and superb experience. We spent an amazing afternoon with Mike and his superb canoe on Pyramid Lake. The conditions were overcast and a little chilly but Mike made the whole trip a warm experience.\nNeedless to say the scenery was stunning. Being able to experience it first hand...","August 31, 2017"
"2091","jlvb26","5.0","Awesome day canoeing. We wanted to do something different in Jasper and decided to book a half day canoeing on Pyramid Lake with Mike. Really great decision on our part :)\nAfter a short ""how-to"" paddle lesson we loaded the beautiful handmade canoe and off we went (my...","August 14, 2017"
"2091","baconator76","5.0","What a wonderful morning canoeing on Pyramid Lake. I know that I'm not going to write anything new that hasn't been written before, but I can't avoid giving my excellent feedback on this amazing trip.\nMike, our guide and one of the founders/owners, is a very nice and friendly guy and you can...","August 13, 2017"
"2091","katdave19","5.0","Highlight of our honeymoon! . Today we had a private trip with Mike on the beautiful Pyramid lake on his HAND CRAFTED canoe.\nMike is so knowledgeable & friendly. He was guide, teacher, geologist, geographer, wildlife spotter, and he brought drinks & cakes!\nI was nervous and had been in...","August 6, 2017"
"2091","blue30","5.0","Perfect End to our Trip in Jasper!. What a wonderful experience we had canoeing Lake Pyramid with Mike of Wild Current Outfitters, using his traditional wooded handmade canoe!\nCorrespondence with Mike was prompt and professional. The location was easy to find and our family of four (sons 19 & 21) found Mike...","July 1, 2017"
"2091","mama452657","5.0","Awesome canoe trip. My family went on a morning canoe trip with Mike on Pyramid Lake we all agreed that it was the perfect way to start our day! Mike was so nice and very knowledgeable about the area. My daughters, 8, 10 and 12 love paddling, running...","June 25, 2017"
