"attraction_id","rating","review","review_date","user"
"791","5.0","Amazing, fun and informative!. Prior to this tour, I knew very little about Sake and only tried it once. I decided to give this tour a try because I heard many great things about New World Wine Tours as well as giving Sake a second chance. Everything was excellent....","June 20, 2018","cubano07x"
"791","5.0","Sake bleu!. Wow oh wow. This was a fantastic experience. I came into this tour knowing three things about sake:\n1) It's made of rice.\n2) It's Japanese.\n3) It can be consumed warm or cold.\nNot only did Mackenzie introduce us to a whole new world...","May 25, 2018","leon_w"
"791","5.0","Great Sake Tour. Mackenzie did a great job with the tour. I already knew a fair amount amount about Sake, but still found the tour incredibly informative and fun. Would highly recommend, Mackenzie really knew his stuff and was able to offer a lot of insights, and made...","January 26, 2018","dmondoux"
"792","5.0","Great Timing, Great Service, Great Wine. I went on the Niagara West Tour. The tour pick up was around 9:30am in Niagara, and drop off was around 5pm. We had 5 wine stops and a lunch stop, which made for an awesome full day. The group size was about 18 which...","June 23, 2016","laurar1chardson"
"792","5.0","Best tour in the region. We booked this tour as the Last day of our weekend-long bachelorette/bachelor party, and it was the perfect end to our weekend of fun! I would highly recommend Discovery Tours if you're looking for a well organized, informative, super fun tour - and of course...","May 23, 2016","cassie_g"
"792","5.0","Wonderful Private Tour. Tim took my husband and I on his East meets West tour this past weekend. We were delighted to find out it was just the two of us on the tour. He picked us up from our hotel in Niagara on the Lake and began...","March 4, 2015","rie13"
"792","5.0","Wonderful. We went on the Wild West Tour on a Thursday in February and our group of three were the only ones on the tour, so it was basically like having a private, very knowledgeable chauffeur for the Niagara-region! Tim, the driver, was super friendly, and...","February 6, 2015","cassie_g"
"792","5.0","First time wine tasting!. My friend and I were picked up at our hotel by Chris. This was my first time doing a wine tasting. My friend had done it before but never with a tour company. We had problems picking up in Niagara on the Lake since there...","March 22, 2014","kidsxfour"
"813","4.0","Best Mom and Daughter Day. Rod was great, right on time, quick and efficient fantastic driver with good sense of humor. Meena at Quails Gate was our favorite. Great hostess perfect wine. Daphny at Mission Hill rushed like crazy so it wasn't very fun but Nick made up for it...","September 9, 2018","amy_g"
"813","4.0","Great wines and wineries . Chris was good. Picked us up on time, and took us to many beautiful wineries. Would recommend this tour!","August 19, 2018","foxs2017"
"813","5.0","Do it!. We had a fantastic time! Daryl was an excellent, knowledgeable host. Definitely worth the money to be driven around to the wineries and have a great narrative.","August 12, 2018","shannonb601"
"813","5.0","Best Day of Our Lives (THANKS LAWRENCE). Honestly, an experience of a lifetime!\nLawrence, was our very personable and knowledgeable tour guide who quickly became our friend! He did everything within his power to make sure our experience was fulfilling, memorable and worth every dollar spent; he did not disappoint.\nThe four...","July 29, 2018","beckyandshane"
"813","5.0","Lawrence treated us like royalty!. We enjoyed a very special afternoon touring 5 great wineries in the Kelowna area. Lawrence was an amazing host, making us feel special and taking care of our every need. He is a class guy!","July 27, 2018","781garyt"
"813","5.0","Awesome wine tour with Lawrence. My husband and I had a great afternoon on the wine tour. Lawrence arrived to pick us up right on time. Lawrence took good care of us at every stop, never rushed us as we took our time enjoying all the different wines of Kelowna...","June 6, 2018","helen_s"
"813","5.0","Daryl is the Man.. Over may long myself and three other friends went on the all star wine tour, it was nothing short of amazing. Daryl was our guide and he ensured that we were taken care of and properly accommodated at all the stops. He even went out...","May 31, 2018","jade_g"
"816","5.0","Cassandra's Bachelorette . This Wine Tour company was the best I have ever experienced. The vehicle was very comfortable for 10 women. Our Drive/Host Dave E. was very knowledgeable, we all came away knowing so much more about wines, wineries, the Niagara Regions and so much more. He...","July 29, 2018","annabelle_t"
"816","5.0","Great way to celebrate a birthday!. We were a group of nine ladies celebrating a special birthday. We arrived at the Niagara Stone Rd. address where we were introduced to our tour guide and bus driver, Melissa. We rode in a very clean and comfortable small bus to Lakeview Winery where...","April 29, 2018","cd0801"
"816","3.0","Good wineries but very poor lunch. Our driver, Wendy, picked us up at the hotel right on time. We then picked up another couple close by and then drove 10 minutes out of the way to 'maybe' pick up another couple. There wasn't a phone available to check with the other...","October 28, 2017","winejunky"
"817","5.0","Great Day in Niagara yesterday. We had a very good tour with Mackenzie yesterday . My Wife and I enjoyed ourselves and we learned a lot about the VQA wines . We were picked up at our Condo and there was a coffee & pastry in the Chevy Traverse for...","March 2, 2019","john_k"
"819","5.0","Bike tour from Vieux-Montreal to Mont Royal and back.. This is the best way to see and experience Montreal, especially if the weather is wonderful, as it was for our tour. Every city should have a bicycle tour like this. Our guide, Michael Theriault, was great. He was entertaining and encyclopedic and worth the...","June 6, 2018","jim28542"
"820","5.0","Great Day Out. 8 of us went on this tour as a Stag party. We were all picked up at the Best Man's house at 10am and driven downtown where we met Cassandra, our tour guide.\nWe visited five breweries - the order being Bent Stick, Situation Brewing,...","May 3, 2018","alnmarg"
"820","4.0","Really fun!. This was a great activity for a bachelorette party! Everyone enjoyed the tours and beer. Our tour guide was on the quiet side but was very friendly and informative. I would recommend music on the tour bus though so the transition from brewery to bus...","November 14, 2017","jillian_b"
"820","5.0","Best Tour in Edmonton. My boyfriend and I took this tour yesterday and it was amazing! Edmonton has some very interesting beer history that we learned throughout the day. Our guide was very informative and she's actually a home brewer as well! The generous samples at each location were...","October 29, 2017","nicolek1300"
"820","5.0","A Saturday Well-Spent. This was a great tour and the guides know both their beer and their city. I not only learned a lot about the different breweries in the area and how they make their beer, I learned a few new facts about the city thanks to...","July 22, 2017","devon_k"
"822","5.0","Excellent Service . I have now used Wheelz as my wine tour service a few times and it just seems to get better and better. From setting up the tour ( very timely responses and very accommodating) to the actual day and driver ( Daryl is great). Thank...","September 15, 2018","g528vvjohnr"
"822","5.0","Superb - this is the one to go with. So we have been to Niagara Ontario 3 times now and done 3 wine tours. Whilst they are all good this one was superb. We went on the 23rd during the heavy snow which made it atmospheric as well.\nNothing was too much trouble for...","December 25, 2017","gb2809"
"824","5.0","Personal Tour. Booked a tour for myself and my husband as a Christmas gift. We live local but love the history, food and drinks from the area. We thoroughly enjoyed our private tour including the salmon samples, local brewery, scotch taste test and local cuisine. I was...","January 8, 2019","cathy_b"
"831","5.0","Great night!. I decided to book this tour cause i like craft beer. derrrrrrr.\nMy wife and I arrived at the designated pick up point. It was a little hard to find cause we had not been to the area before but found it after a bit....","March 3, 2019","todd_s"
"831","5.0","Lots of beers to taste, friendly atmosphere. The guide, Nikki, knew her stuff and was friendly, but she also wasn't in your face and left you time to talk with others. My quibble is that there is a mention of pairing foods with beer but, while all the snacks at the breweries...","February 14, 2019","ray_w"
"831","5.0","Beers catered to interests, great range of tastings. My group had a great experience with our brewery tour. Our tour guide was very knowledgeable, and picked flights of beer that were well suited to our tastes. I would highly recommend this tour to anyone wanting a fun, casual experience and who is open...","December 23, 2018","jaybren"
"831","5.0","Craft beer & Nikki are AWESOME!!!. I was fortunate enough to book a last minute tour through Canadian craft tours!!\nWe had amazing visits where our giide Nikki les us through an incredible journey through amazing craft beer journey!!","December 21, 2018","brenda_s"
"831","5.0","End of season party with hockey team. My hockey team booked an entire tour bus for our end of season party this year and it was an awesome event! The host, Jordan, was really knowledgable about the brewing process and and all around nice fun guy. Our group had a blast. We...","December 17, 2018","jason_b"
"831","5.0","Team Building Brewery Tour. I won a team building brewery tour through the BC Brewery Tour Facebook page for myself and my colleagues. There was 8 of us and hit up Parallel 49, Andina's and Strathcona - all the beer was very delicious!. Jordan, our guide, was fantasitc and...","December 3, 2018","kim_g"
"831","5.0","Jordan is an amazing guide!!. 4 of us went on the beer tour yesterday and had such a great time! Jordan our guide was fantastic - super knowledgeable and a great person to spend 3 + hours with. The selection of the breweries was great - the beer was delicious...","November 30, 2018","adreger"
"831","5.0","Nikki is the Finest, beers great too!!!. Me and the crew were in town from VA, and weren't sure what to do... our hotel suggested as we like beer, why not check out a brewery tour!! We went on trip advisor and among the reviews and candidates we decided to go with...","November 25, 2018","milfordj2018"
"831","5.0","Brewery Tour. My Husband and I did our very first brewery tour ever and we had the best time. We went to placed we wouldn't have gone to just walking around Vancouver and all the stops were informative and gave us a variety of tasters so that...","November 7, 2018","shelle51"
"831","5.0","Looking for a fun adventure in Vancouver?. Looking for a fun adventure to do in Vancouver with friends and family? I finally went on my very first Beer Tour this past weekend with Canadian Craft Tours and it was such a fun time! Canadian Craft Tours brings you on Beer, Wine &...","October 25, 2018","subscriptionboxgirl"
"831","5.0","Port Moody Brewery Tour. Nikki was a great host and accommodated dropping us at the Skytrain station as we are from New Westminster. We really enjoyed the breweries and the tour we were offered of the brewery at Yellow Dog (our favourite). Highly recommend this for everyone (anyone above...","September 23, 2018","smilingirish2018"
"831","5.0","Amazing times on our Bachelorette!. This is such a fun and easy thing to do with a bunch of beer drinking, fun-loving ladies! Scott, our tour leader, went above and BEYOND guiding/touring us, getting us in to some cool spots, and making sure everyone got to a safe location after...","September 19, 2018","laurel_c"
"831","5.0","Amazing beer and tour. Liz organised her tour and she really did us a solid. We had someone cancel and the tour wasn't going to run and after seeing how disappointed we were she took it upon herself to run the tour and rope some friends in as well....","August 23, 2018","james_s"
"831","5.0","Port Moody's finest. We had a great time with Scott. He was very knowledgeable and friendly. We went to Twin Sails, Yellow Dog and Mariner. We got a bring the scenes tour of Yellow Dog which was very informative. We enjoyed the atmosphere of Twin Sails, the beer...","July 19, 2018","shamus_p"
"831","5.0","Awesome!. I attended a tour for a bachelor party. The guide was super friendly, knowledgeable, and open to any and all questions we had. I started as a total beer noob, and she totally helped me gain appreciation for the craft and product (I now have...","July 4, 2018","brandon_d"
"831","5.0","AMAZING-SO fun!. We had a wonderful time! Maria our tour guide was wonderful! She took great care of us, educated us on all the beer and was a lot of fun! Can't say enough good things!!! totally recommend this!","April 29, 2018","bayley_r"
"831","5.0","Great tour with Maria. Fantastic afternoon visiting 3 brewery sites with Maria. Great fun a lot of laughs. Highly recommended. The beer was pretty good too BTW!","April 26, 2018","dcasaus"
"831","2.0","Wouldn't recommend. Overall I would not recommend this tour. Driver showed up late. We went to two smaller breweries but also one larger/big brewery. I expected at least one in-depth tour from the breweries themselves. We did walk around a couple of the brewery areas but it...","April 5, 2018","badgerlamp"
"831","5.0","Awesome experience. I went on the craft brewery tour on March 17th with a couple friends and had an awesome time. The tour guide, Aaron, was a lot of fun and really seemed to care that everyone had a great time. It was cool to try so...","March 18, 2018","jasonvancouver"
"831","4.0","Great Friday night. Had a great time our our tour with Jocelyn. We did a private tour (8) which meant they picked us up at downtown where we requested, then went to three breweries including Parallel 49 and Andina. Parallel 49 was cool with the Food Truck inside...","January 22, 2018","dave_p"
"831","5.0","Gilligan WISHES his 3-hour tour was as cool as this!. My buddy and I took the brewery tour over the Remembrance Day weekend and Boy Howdy was it a beauty! Our guide, Oliver, was friendly & knowledgeable and navigated his van thru Van' from brewery to brewery with a finesse that's hard to compare. I...","November 15, 2017","malcolm_y"
"835","5.0","Super cold but fun. It’s a great activity for people with younger kids. It’s very cold, even though they give you blankets to use you should still layer up since you are sitting still for about 45 minutes you will start to freeze.","February 19, 2019","17marmar"
"835","2.0","Yawn. Guide was talkative, fun to interact with. Course was boring, nothing of interest to see. Wait till spring/summer and take a real horse back ride.","February 6, 2019","daniel_r"
"835","4.0","beautiful but cold!. My group opted for the 45-minute sleigh ride in the back country. We booked early for our time slot which was quite simple to do. We arrived about 30 minutes early which let us see some of the horses and talk with one of the...","January 23, 2019","chrissy716"
"835","5.0","Great activity!!. Went on this sleigh ride at the end of our weekend trip to Banff. It was the perfect last activity before the drive home. The staff were knowledgeable and friendly and the horses were gorgeous. Mike was our guide and clearly loves his job. All...","January 20, 2019","goaliemom53"
"835","4.0","Disappointment due to lack of snow. Our family of 4 (2 adults and 2 young children) travelled from Australia primarily to experience a white Christmas. One of the activities we prebooked and were looking forward to was a Sleigh Ride. Online Booking was easy.\nUnfortunately we received an email the day...","January 16, 2019","973sharynw"
"835","3.0","Didn’t live up to expectations. Took family on a morning sleigh ride expecting a bit of theatre to go with the experience as promoted\nNo real description of horses or country side offered\nBasically you do a couple of laps of open paddocks adjoining stables and a cup of watery...","January 2, 2019","aussiedavewitta"
"835","5.0","Fun family activity. Our family of three took this sleigh ride. The place is clean and organized. After booking tickets online, we arrived the next day and were greeted by friendly staff. We started with apple cider or hot chocolate and then waited until our family name was...","January 2, 2019","maryjanel329"
"835","5.0","Beautiful place and relaxing sleigh ride. Friendly staff and beautiful area. We enjoyed it and got many beautiful pictures. They provided hot chocolate and blankets to keep warm.","December 28, 2018","158ericaw"
"839","3.0","Not a terrible way to spend a couple of hours, but don't go hungry!. This was not my first food tour, so I went in with a preconceived notion of what to expect...That was my downfall. While our tour guide was lovely and very knowledgable about Quebec City, this was more like a walking tour with VERY light bites,...","December 19, 2018","megan_k"
"840","5.0","Great Learning Experience!. My family and I (with kids ages 7 & 10) did the Christmas Magic walking tour on Christmas Eve. The tour guide was quite knowledgeable and very friendly. She was great with our kids too. The tour was just over 2 hours with enough stops...","December 29, 2018","katewake"
"840","5.0","Truly Magical. My daughter took me on this trip. We stayed at Fairmont Le Chateau Frontenac. Which was magical in itself. But we rode the funicular from the back of the Fairmont down to Old Quebec and the moment you step out you are just in awe...","December 12, 2018","sabra557x"
"844","5.0","Great Tour!. We were looking for an interesting tour of Old Montreal that would highlight the Christmas atmosphere of the city. Our tour guide, Pierre, did a superb job incorporating the history of Montreal with the lights and traditions of the Christmas season! Merci Pierre - très...","December 31, 2018","mckeeverk"
"845","4.0","Lovely time. Three girl friends and I went on the ice wine tour. We had a nice time and enjoyed the education and the tastings. We got to see a larger production vineyard and we went to a small, family owned vineyard as well where we got...","May 14, 2018","jessica_d"
"845","3.0","Tour best done during harvest season. I gave this an average rating as we did the tour in the middle of winter. It was very cold and we did a very brief tour of the vineyards outdoors. The wine tasting was amazing! Would have been nice to see the ice wine...","March 17, 2018","vitabella5"
"845","5.0","Great experience . Arrivals and departures were on time. Sabin was our driver/guide. I loved not only learning about wines but also about Montreal and Quebec history. He was very pleasant, professional and knowledgeable. Hosts at the wineries were warm and welcoming. Lunch was delicious. It was a...","February 26, 2018","angie_d"
"845","1.0","Needs improvement . We stayed in Quebec City and took a 3 hour bus to Montreal just for this tour. Our tour guide was over 45 minutes late and I was not contacted at all. I had to reach out to the company only to find out they...","February 24, 2018","raizel_h"
"845","4.0","Professional . Our tour guide was 45 minutes late to pick us up however Kava Tours contacted us immediately and gave us updates. Other than that no issues. We really appreciated how they kept us up to date. I did the half tour which was two wineries...","February 23, 2018","pzinnikas"
"847","5.0","Fantastic way to see Canada!. I recently finished the Rockies tour with discovery Canada. Wasn't too sure what to expect as it was my first tour.\nHave to say an amazing experience and a very easy pace even though we saw so much.\nEvery stop on the tour was ticking...","March 14, 2019","elleraidal"
"847","4.0","Good Experience. The trip was fine! The script was good (not perfect)! Congratulations Michelle! The cities we passed/stoped were very interesting! However, on the second day breakfast (a fruit, a juice, a muffy and a cereal bar) was offered by Discover Canada Tours and not by the...","February 19, 2019","renatomerli"
"847","5.0","That was awesome 👍🏻. That trip was really nice! The landscapes are breathtaking and the two tour guides were amazing, Michelle and Erika did a great job! Even if the weather was cloudy it was really great! The ice walking activity was nice, not so hard, I recommend it.","February 19, 2019","eliseloum"
"851","5.0","Ice Fishing. What a fantastic day. First timers at Ice Fishing. Started with hubby catching the first fish of the day within one minute of dropping a line. A nice Bull Trout. Then I caught a Sucker & 2 Bull Trout. Our guide Rick was friendly and...","March 22, 2018","karenmt30"
"851","5.0","Amazing Ice-fishing experience. 我們一家四口來自香港，這次釣冰魚的旅程留给我們非常深刻的印象。在結了冰的湖上，風景怡人，環境清幽，導遊先生專業的知識及服務令我們成功釣到一條大魚及數條較小的魚(虹鱒魚)，牠們也成為了我們的美味晚餐！我們期待在不久的將來再度參加這個活動，這是絕對值回票價的！\nPemberton Fish Finder (PFF) is absolutely awesome! We are a family with 2 boys from Hong Kong, it was our first experience in ice fishing in Canada though we had done that in Korea before. But the experience with PFF was totally incomparable. First,...","February 3, 2018","abcdtams"
"851","5.0","Awesome experience . Shout out to Scott who was an awesome guide with lots of knowledge and experience. We had a great time ice fishing just outside of Whistler on a half day tour. Between the 3 of us we caught plenty of rainbow trout. As the weather...","January 9, 2018","tomeaus2017"
"851","5.0","Brilliant experience. Excellent guide - can’t Waite to go again. Ice fishing was something I wanted to do for ages, so when I got to go to Canada I was not about to miss out on the experience. Pemberton Fishfinder were fantastic to deal with, We were picked up from Whistler and taken to the...","December 19, 2017","boobrisbane"
"852","1.0","Couldn't reach anyone there. All I could do was talk to a poor call center guy who kept trying to reach his ""supplier"", and was not able to talk to anyone to book a trip.","January 25, 2018","roy_p"
"854","5.0","HAUNTED TROLLEY TOUR. I took this tour on Halloween night. I enjoyed Madame Lidia as our tour guide and found her stories very interesting, especially with her Gypsy accent. Alot of the stories, I knew nothing about, which made this a more interesting tour. Our driver was very...","November 1, 2018","ssiwasch"
"854","2.0","Haunted trolley tour. Very weird tour.. expected Halloween theme at least somewhere through this 2h 1/2 narrated tour on ghost stories and haunted stuff. Was very long and boring..\nWent to this cemetery to,listen to more stories on tumbstones then went to this police museum to tolerate some...","October 31, 2018","marilyn_b"
"854","4.0","Haunted stories. It was a great night for the tour. The tour guide was great, funny and had lots of interesting stories.\nThe only flaw was he did not take control of the noise disturbances during the tour from a group of intoxicated and extremely annoyingly loud...","October 21, 2018","jaycamire"
"854","2.0","Dull. There wasn’t any issue as the service was well organized and everybody friendly but the content was very dry and uninteresting. Needed more rich storytelling and imagination. The Coroner Court and autopsy room was pretty good.","October 20, 2018","r4079uabrianf"
"855","5.0","Great atmosphere, fun tradition with family & friends. We were on the Carolship Dinner Cruise couple weeks ago with friends and it was just great!! The open buffet had a variety of foods; main dishes were turkey & ham and they were all very delicious, dessert buffet was soo yummy. Carolers greeted us...","January 2, 2019","pinarvan"
"855","3.0","Mediocre food, good entertainment . Went with another couple for the Carol Singing Ship. The food buffet was very limited, but what they did offer was food.\nDessert was very poor-no hiding they were mass produced frozen cheese cake and chocolate logs...dry, tasteless.\nCocktails were ok, but seemingly virtually no...","December 22, 2017","llcoold"
"859","5.0","Valentine's Trip. Chris was a wonderful guide, very friendly and knowledgeable. We did the tour in February and really enjoyed the Frozen Falls. The smaller group sizes was nice and intimate. The attractions included in the tour...Behind the falls, Niagara Fury, Skylon Tower, and Butterfly Conservatory really...","February 16, 2019","loufene"
"859","5.0","Go !. Don’t scrimp / go for it - you are there do the tour - see what so many others haven’t\nGet behind the fairs","February 10, 2019","suzanne1209"
"859","5.0","Maid of the Mist Boat Ride. Really exciting -- got really wet even though wearing one of the plastic capes. Amounts of water falling are overwhelming,","January 14, 2019","voyage256140"
"859","4.0","Informative Guide. The guide was good in the sense that he was informative and willing to accommodate our requests if we wish to change some of the itinerary due to weather. He also was nice to re-schedule the itinerary so that we could get the best out...","December 31, 2018","kongzi8"
"859","5.0","tour package. The tour was well organized. We saw exactly what we came for and the price was great. We had our teen grandchildren who never saw anything so grand before.","December 13, 2018","mrelaxin"
