"attraction_id","rating","review","review_date","user"
"951","5.0","English Pete found a Grizzly!. After promising us a great tour and introducing himself as ""English Pete,"" we were off to a great start. A comfortable bus, an erudite tour guide with a passion for his work and the beauty of the nature around us made for an unforgettable day....","August 7, 2018","lisa123000"
"951","5.0","A beautiful tour with so many convenient options for pickup and drop off. We joined this small tour on July 3 and were picked up outside of the Banff RV Campground. It was the late afternoon tour which included a nice dinner meal which was very good but the highlights were the two lakes. The tour size was...","August 6, 2018","needreve"
"951","5.0","Moraine Lake was amazing. When your family needs 2 rental cars, it's way better to go on tours, and this one filled the bill. It was accessible for family members from 31 to 87 years old. Our guide Neil E was very knowledgeable and made the trip interesting and...","August 4, 2018","jay_c"
"951","5.0","Moraine Lake beats them all!. Lake Louise was beautiful, although you need to walk around it a bit to get away from the hordes of tourists. But Moraine Lake was even more amazing and less crowded. We walked up the rockpile to get a higher view of the Lake -...","August 3, 2018","lorna_k"
"951","4.0","My mother-in-law was pleased . There were 9 of us in our group including my 82 year old mother-in-law and our teenage daughters. My mother-in-law is quite an active person but we were a little worried about hiking and getting around on the trails. An organized tour was a great...","August 1, 2018","mike_b"
"951","5.0","Excellent trip to Banff. We loved this tour, we were excited to see Lake Louise, but the real surprise was Lake Moraine. Our guide Andy was very personable and shared lots of information with us. Highly recommend!","July 25, 2018","janet_w"
"951","5.0","Lake Louise & Moraine Lake. An absolutely wonderful trip! Our tour guide, Nicole, was excellent. All 9 of us thoroughly enjoyed every bit of the trip.","July 18, 2018","louis_p"
"951","5.0","A must see in Banff!. Andrew was an amazing, kind, knowledgeable guide. Magnificent scenery in a very well-paced day. We were lucky enough to see bears.","July 18, 2018","vera030"
"951","5.0","Wonderful Sightseeing Trip. We really enjoyed our sightseeing trip to Lake Louise and Morraine Lake. Norm was an excellent tour guide and very knowledgeable. The dinner at the Bear Creek Lodge was excellent. We saw a black bear and some elk on the trip. Great trip,","July 13, 2018","mary_a"
"951","5.0","Deluxe Lake Louise - Very Enjoyable. This was actually a 6 hour event that started at 3:30 p. Eight of us in a mini van were escorted by a driver, Hugh, who was friendly, knowledgeable and had a nice sense of humor. The included dinner was rather skimpy and just okay...","July 13, 2018","marilyn_h"
"951","5.0","amazing. I was very lucky, could go to Banff National Park.\nThe view very amazing , with rocky mountain around.\nI could see also great Lake Louis , with the great view.","July 12, 2018","94nany"
"951","5.0","great trip, great guide. Thibault was pleasant and informative. If you've never been, this is the tour to take and the company to take it with. We did another similar tour and while it was OK this tour was better.","July 9, 2018","john_c"
"951","5.0","I would definitely recommend this tour.. Big shout out to Scott who was our guide; he just makes you feel so comfortable and welcome. Tells great stories and gives loads of information.\nIt was so beautiful I can home with a lot of pictures.","July 7, 2018","canihope"
"951","5.0","Excellent Tour. We took this tour with our son and daughter-in-law on July 6, 2018.\nOur driver and guide, Anique (sorry if spelling is wrong) was fantastic. She provided great insight and information during the tour and was very pleasant.\nLake Louise is very nice and Moraine...","July 7, 2018","peter9406"
"951","5.0","Great experience!. I thoroughly enjoyed the Deluxe Lake Louise and Banff tour in June. Tour Guide “Anik” was extremely knowledgeable, professional, and accommodating. The small group size was so comfortable and yielded a very relaxed and pleasant tour. Scenery and photo ops were fantastic.","July 7, 2018","ac1045"
"951","5.0","Wonderful Tour!. Great idea to take these tours into these very crowded parks during summer at least! We went right up close to both lakes.... no problems! Absolutely a must see tour. Scott our tour guide was great and very nice. Knew the area very very well....","July 3, 2018","linnbig"
"951","5.0","Lake Louise Beauty!!!. We toured Lake Louise and Lake Moraine with Elv and he was wonderful. Before the tour, we had a great dinner at a quaint little lodge. Elv had wonderful stories and information to share with us during our travels. He was fun to be with...","June 25, 2018","duke_m"
"951","5.0","Beautiful Lake Views. My husband and our two teenage sons took this tour to give us some time away from being behind the wheel and to enjoy the scenery on the way. Our driver, Tom, was a fantastic tour guide. He was very informative during the entire drive...","June 24, 2018","smee4"
"951","5.0","Deluxe Lake Louise and Moraine lake with Neil E.. I booked this tour before coming to Banff and 24 hours before the tour there were only 3 people booked so thought it wouldn't go ahead. The people in your office were great and kept me informed. Thankfully 2 other people booked and due to...","June 24, 2018","1ana48"
"951","5.0","Lovely lake and food!. We did the Lake tour that includes a meal (I think it was called the Deluxe tour). We went to see the Castle Mountain, and had an early dinner at the Baker Creek bistro. I ordered the local arctic char, and it was delish! Then...","June 23, 2018","vixklen"
"951","5.0","Great Tour!. Pete was our guide and he was excellent - full of information and personable. The bus was comfortable and we enjoyed the ""big"" window in the front of the bus, which allowed for a view that is generally not available in other buses. I would...","June 20, 2018","melma16"
"951","4.0","Lakes tour. Really nice day with the tours of both Lake Louise and lake moraine. Really beautiful and an opportunity to take great pictures. Our tour guide was very knowledgeable.","June 18, 2018","ankush_b"
"951","5.0","Great day at Moraine Lake. Roni was a friendly, flexible, committed and good-spirited guide. We did a day tour with a couple of stops. We spent most of the time at Moraine Lake. It is so very beautiful. We went in the middle of the week and there was almost...","June 16, 2018","wirawee"
"951","5.0","Great tour guide! Beautiful views!. Participated a Deluxe version of this tour. Our guide Scott is super friendly. Had a good time with the group. So much fun! One thing worth mentioning is that this deluxe trip is 2 hours longer than the normal one and more expensive because it...","June 13, 2018","elaine_l"
"951","3.0","If you can avoid the crowds....... I remember once being tolled about a place “it was great until the likes of us started recommending it to the likes of you!” This sums up these venues. At the beginning of the summer season, on a Monday, there were crowds around Lake Louise...","June 8, 2018","mansle2016"
"951","4.0","Thanks to Matt and Lenka. It was good experienced for me.Learn something new about what banff and lake louise can offer to visitors and local alike. Well done!.\nAnne","June 8, 2018","anne_macachor_a"
"951","5.0","Wonderful Scenery. This was part of our Rocky Mountaineer trip. Our driver, Matt was very knowledgeable of the area. He stopped at several spots that had wonderful views. It was a very nice, informative trip.","June 2, 2018","cyw"
"951","5.0","Great tour - absolutely stunning scenery and excellent guide!. We thoroughly enjoyed our late afternoon/evening tour to Lake Louise and Moraine Lake. The weather was absolutely splendid adding to a totally magical experience at the Lakes. Our guide for the event was Nicole - she was very informative and had a wonderful sense of...","May 28, 2018","happyhols320"
"951","5.0","Comfortable and interesting trip to Lake Louise. Nicole took my husband and I out to Lake Louise and provided lots of interesting information. There were only about 10 of us on the bus, all different nationalities. We don't usually do tourist buses like this but it was our last day in Banff...","May 21, 2018","cazzyk"
"951","4.0","A little early to see everything. I knew before signing up that it was still to early in the season to get up to Moraine Lake, so I personally was not disappointed -- but if it is still May, be sure to check the itinerary. Best part of the tour was...","May 7, 2018","prof1950"
"951","5.0","Beautiful Sites - wonderful guide!. Visited the gorgeous Lake Louise, trails and sites and of course the beautiful mountains along the Bow Valley parkway today! Our tour guide, Aaron, was wonderful providing information from the past and present and lots of fun facts! Think we can say we are all...","May 3, 2018","nana2point0"
"951","5.0","Banff national park tour . Great tour which was enhanced by the tour guide Aaron who went above and beyond the call of duty to make the trip enjoyable in no small part due to his enthusiasm and knowledge of the area. I would highly recommend this tour.","April 30, 2018","peterhp7060bz"
"951","4.0","Staff really good. We couldn’t go on the tour but the tour guy was more than helpful and tried to find another solution. The office staff were also very good.","April 24, 2018","kath107"
"951","5.0","Great guided tour of Lake Louise and surrounding wildlife. The tour was great, the time at Lake Louise Fairmont Chateau was perfect. Aaron our guide was great!","March 6, 2018","dewranged"
"951","5.0","Beautiful and comfortable tour. The tour guide is well-prepared. I am not good at planning, so I felt comfortable to travel with 'discover banff'. I borrowed the snowshoes and had a great time hiking up the mountains near the lake. I like the hot chocolate.","February 16, 2018","u0303mok"
"951","5.0","Beautiful lakes. We took the Lake Louise and Moraine Lake Tour on 10/9/17 which was the last day to visit Moraine Lake for the season. I believe they close the road because of potential landslides during the winter.\nBoth Lake Louise and Moraine Lake were beautiful. We...","December 14, 2017","masiew2017"
"951","4.0","Great tour and lovely day! . We went on the Lake Louise tour today and had a great time. Our guide (90% sure her name was Nicole but didn’t quite catch it sorry) was very helpful and funny. She knew a lot about the local area and wildlife which was great....","December 5, 2017","leanajane"
"951","5.0","A great way to see some of the highlights of Banff in one afternoon. I was in Calgary for a business trip and decided to go to Banff for one day as it had been on my list of places to see. I took the Discover Banff & Lake Louise tour which was from about noon to 5PM and...","October 29, 2017","amelieartist"
"951","5.0","Banff-Lake Louise Tour inbetween saison. Woww, it was a fantastic tour. Rather colder for this time of the year, it even snowed at Lake Louise. In spite of everything. Our guide Ben (English man) knew great. He explained us a lot and could answer all our questions. Everything has been...","October 26, 2017","angela_k"
"952","2.0","Disappointed. The experience did not. Live up to the advertised expectations. The heated bus, was not heated and extremely cold and uncomfortable. The Guide / driver did not speak or do any explanation of the Aurora. The good food and drink, was a bunch of packaged...","March 9, 2019","blckdog"
"952","4.0","Nice tour . Sophia was the guide on the tour I took, and she was woderful - such an asset to the company.  Before I did the tour, I didn't understand that seeing the northern lights with your naked eye isn't always possible, so that was a little...","October 16, 2018","kat_m"
"952","4.0","Great time. Our primary purpose for this tour was to see Aurora. The activity of Aurora was strong at that time (end of August), but clouds were obstacle and it did not happen. It is definitely matter of luck and curtain weather condition together with Aurora activity...","October 1, 2018","almab2508"
"952","3.0","We are in hands of the gods. They pick us from our hotel on time, the place was ok, hot water, plenty of explanations but the Aurora Borealis is a mix of solar winds, clear skies and the hand of the gods, and there was no lucky this time. But above all...","September 25, 2018","cardiointernista"
"952","5.0","Nice Evening. We booked in to do the aurora evening after a snow shoeing trip with Arctic Range.\nPick up from the hotel went nice and smoothly, and we were taken out to where their huts were outside of Whitehorse itself. The buildings were nice and warm,...","March 5, 2018","mel_m802"
"952","1.0","Not good company. I’ve paid a trip to see the auroreas today, but the weather is so bad, it’s snowing a lot. I’ve asked for changing the trip to another day but they don’t let you and don’t refound the money. If you book the trip with this...","February 22, 2018","marcg283"
"953","5.0","Great choice. I love this tour, and Erick (tour guide) was fantastic, fun, positive, respectful and he was so attentive, that he played music from our origin place. Five stars!!!","October 22, 2018","normitza_d"
"953","5.0","Vancouver Vacation. We decided to take the city tour with a stop at Capilano Suspension Bridge, and we are glad we did! The park is fantastic! What a unique experience as you walk across the suspension bridge! The walk among the trees was also great!","September 8, 2018","rbarnes4"
"953","5.0","Go early avoid the crowds. Recently visited Capilano Bridge. There is a free bus thats takes you to Capilano. It sets off from Cananda Place but has stops along the way. We caught the bus in the West End on Robson St outside the Horison Hotel. It is the same...","September 5, 2018","whatever18"
"953","5.0","Gourgous. These are definitely bucket list place’s to see , Grouse mountain actually took my breathe away , it was one of the most stunning places I’ve every been too . Capilano bridge was so cool , if scared of heights i’d Give it a miss...","August 25, 2018","donna_m"
"953","5.0","Amazing Experience. We took our daughter and her family to Vancouver and this was one of the things they picked as a must-do. It was an amazing experience - beautiful views and an education nature walk, viewing the area from literally the tops of the trees. The...","August 18, 2018","acdehart"
"953","4.0","Take as long or as short as you like. We enjoyed our time at the Capilano Suspension Bridge. It was less than 10 minutes from our lodging so it was a layup in terms of an activity on the list. It is very well designed and built and completely self guided. There are tons...","August 7, 2018","davebork"
"953","5.0","Great Tour!. Our guide, Jason, was friendly and knowledgeable. He engaged with everyone on our tour. We saw the highlights of the places that we visited and it was a great day!","June 28, 2018","emmaxstitch"
"953","4.0","GREAT DAY. Fun Day. Our driver was knowledgeable and engaging. We were met in our hotel lobby. The whole tour is well organized. Our first stop was Grouse Mountain and a ride up the gondola beautiful views. Once on top a lumberjack show and a visit to...","June 20, 2018","eabgjm"
"953","5.0","Great place to visit at Christmas!. Went here with daughter for Christmas, had a wonderful time hiking Grouse Grind on snowshoes, The bridge and park were gorgeous!","June 19, 2018","marcie_h"
"953","5.0","LandSea Tours - great day out. Thoroughly enjoyed a day with ""Ed"" the driver. Picked up at our hotel and taken to to the Salmon Hatchery, such a wealth of information shared easily. Enjoyed a trip to the Cleveland Dam and a walk through pristine forest so close to city Vancouver....","June 10, 2018","atholstan"
"953","5.0","Best day out . We just had the greatest day on this tour, even though it was a rainy day we still had a great time, our tour guide Maggie was lovely and even took photos for us. We spent a couple of hours at Capilano and then went...","April 28, 2018","lucinda29"
"954","5.0","More than we hoped!. We had a group of 25 people for our whale watching excursion, and we had such an wonderful day! We saw ten to twelve Humpbacks! Black and white dolphins! Porpoises! Seals! Birds! We didn’t know which way to look at some points because there were...","October 22, 2018","explore589300"
"954","5.0","Exceeded expectations. We had to cancel last minute due to a mistake in our travel from Richmond to Victoria. Tripadvisor policy would not refund us so we went into the office of the Whale watching cruise. After explaining the problem, they allowed us to join them a...","October 20, 2018","roel_s"
"954","5.0","Exceeded all expectations!. What an adventure this was! Being our first-time whale watching we didn't quite know what to expect however what we received exceeded all expectations for this excursion.\nGreeted with a friendly staff at their main office we were told what we could expect and how...","October 12, 2018","chris_and_reg_t"
"954","5.0","Very friendly captain with respect for animals. The captain was a really friendly guy with respect for its passangers, lots of knowledge about the whales and deep respect for sea animals as well.","October 11, 2018","jimmy_r"
"954","5.0","Whales and sea lions!!!. We booked this tour last minute and were so glad we did. Even in October we saw orcas, humpbacks,and sea lions. It was wonderful for my entire family. The guide and captain were friendly and very knowledgeable. Would definitely recommend!","October 9, 2018","hjf4116"
"954","4.0","Successful venture. The crew on our tour was very good - the two naturalists were friendly and knowledgeable. The weather was less than ideal, but the captain navigated us safely through, and we did see a couple of humpbacks, a male Orca and his mother as well...","October 9, 2018","jodir853"
"954","5.0","Whales, whales and more. You know you have seen some incredible whales “up-close” when the naturalist on board is getting here camera out and she has excitement in her voice. It was a great morning tour filled with a far and up close orca whale sightings. I would highly...","October 4, 2018","jc091958"
"954","5.0","A must do experience!!!. Our whale watching adventure was simply amazing! Our tour left the dock at 1 pm and about 40 minutes into the trip we happened upon a pod of about 12 orcas who were in the midst of a feeding frenzy! Fortunate for us, but not...","September 28, 2018","gina_r"
"954","5.0","Absolutely amazing and excellent experts . This was a fantastic trip where we were so lucky to see 4x Orcas swimming along near to the boat. The guide had a record of all the disctintive markings on the whales which meant that with my partners slr camera we could zoom in...","September 20, 2018","alireeve2017"
"954","5.0","Amazing. Not the first time going whale watching but it's amazing every time. Saw whales and seals and lots of birds. Excellent knowledge and information given by naturalist/guide. Would go again and recommend it to anyone.","September 14, 2018","monique1232018"
"954","5.0","WOW, amazing. This was our first whale watching tour and we weren't disappointed. Saw at least 3 humpback whales, our captain, Brad, saw one swim right underneath our boat and come up just a few feet away from the back of the boat, was amazing. This was...","September 10, 2018","johanna_h"
"954","5.0","Well worth it!. My husband and I went yesterday, Sept 4, and we an awesome adventure! Staff was very informative and friendly. Our captain was in constant contact with other boat captains to ensure we found whales in the area. We were lucky enough to have a humpback...","September 5, 2018","dreamer711966"
"954","5.0","Whales and more whales. We booked this outing knowing we may not see any whales.\nAbout 20 mins (?) into it, I thought ""I don't think we're going to have any luck today, but at least it's been a really nice boat ride"".\nThen the captain cut the engines...","September 4, 2018","colingmiller"
"954","5.0","A Must-Do while in Victoria. We had the best time on the Five Star whale watching tour! We went on the 10:00am tour with Tiffany as our guide. Very knowledgeable and friendly. We were on the catamaran boat (did not wish to do a zodiac tour) and it was fun...","August 29, 2018","wendy_g"
"954","5.0","Amazing Whale Watching. Saw 9 whales, a family of 6 orcas and 3 humpbacks who breached 4 times. Amazing to see the whales come flying out of the water, a rare but delightful experience. Tour guides were very helpful.","August 26, 2018","jason_t"
"954","5.0","amazing experience - 2 whales, Orca Pod and beautiful protected Marine area. Wow, Wow Wow! We had such an amazing experience!\nWe lucked out with this trip -- first of all, the weather was beautiful and sunny. We also saw 2 different Humpback Whales, and a huge pod of Playful Killer Whales.\nThe boat was comfy with...","August 22, 2018","jenniferpv9021iq"
"954","5.0","Great experience. We were on the smaller 12 passenger boat. Tom was very knowledgeable and we saw 2 pods of orcas as well as a humpback whale. Overall a very good experience but I did feel a bit seasick on the way back.","August 12, 2018","gsaracco"
"954","5.0","Whale watching bonanza. Our family went on the afternoon whale watching cruise and came up trumps. We saw three humpback whales and at least 15 Orcas. A brilliant afternoon. The naturalists kept us well informed of what we saw and the ecology of the area. The trip was...","August 9, 2018","rayc312"
"954","5.0","They are experts. We had a fabulous time on this tour. We found some killer whales who were in the middle of celebrating together after a successful hunt. Note that due to regulation you cannot see the whales from more than 1 km away - bring binoculars! Our...","July 30, 2018","larena703"
"954","5.0","GREAT day. We saw a Humpback, a pod of Orcas and a cute otter. It took a while to find the whales but once we found the Humpback, we then saw the Orcas. It's really cool how the captains communicate between themselves to help everyone have a...","June 29, 2018","pricegals"
"954","5.0","Wonderful Experience!. My mother and I recently took a 5 Star Whale tour-what a wonderful time. The boat has multiple viewing areas-upstairs in the hurricane zone, areas to sit bow and stern of the boat, and covered seating as well. On our trip we saw Humpback whale...","June 13, 2018","karen_r"
"954","5.0","Amazing time!. We had an amazing time today whale watching. It was a great treat to not only see a humpback but also a sea otter, stellar sea lions, seals, a couple bald eagles chilling out on a rock, a bunch of different diving birds and an...","June 5, 2018","tasha_g"
"954","2.0","Disappointing experience. We set-off on the basis that if we follow the food we find the whales - in actual fact we took what felt like a fairly standard run up the coast and back.\nAppreciate that seeing the whales isn't guaranteed but we saw only one...","June 2, 2018","951helene"
"954","5.0","Great day on the water. We and another couple visiting from Australia had this tour booked using a Groupon coupon. At the last minute we asked to add our son attending UVic to join us, fully expecting to pay full price for his booking, but they happily added him to...","May 31, 2018","suncoasters2014"
"955","5.0","A wonderful, well-organised tour. We visited Yellowknife for a few nights to see the aurora and used a few different tour companies. Arctic Tours Canada were the best organised. They have different phone numbers at their office for Chinese and English and they are quick to answer if you...","March 4, 2019","northernvisitor548"
"955","1.0","Disappointing , from start to finish. It was snowing all day , so we knew we were not going to see anything. Too late to cancel. When we booked , we were told that we would be picked up at our AirBnB. The day of the tour , we received an...","January 23, 2019","bobnpaz"
"955","5.0","Finally saw aurora because of Winfred's perseverance. We did not see aurora on 31 December 2018 because of the bad weather and because we joined another tour which waited for aurora in a tent. The bad weather persisted on the following 2 nights when we joined this Arctic Tours Canada. We read...","January 22, 2019","mo_lung_c"
"955","5.0","Fantastic staff and unforgettable experience . We did this tour two nights in a row because they were fantastic. The first night we had Winfred and he was very knowledgeable about the Aurora. He drove us around to hunt for the lights and even thought we didn’t get a chance to...","January 20, 2019","caitlyn_t"
"955","2.0","Not a so great tour. December, 25th: This tour always stop at the same places. We were in a minivan (2nd bus broken) and there were no communication between the first bus and us so we lost each other. Our driver didn't seem to know what to do or how...","January 9, 2019","toulouse1102"
"955","5.0","Friendly staff and excellent viewing of the Aurona. We took an Aurora Hunting tour with Alison as the tour guide on December 26, 2018 and stopped at 3 spots (all on lakes) outside of Yellowknife. At the first spot, the aurora was weak and we could not see anything, but Alison found the...","December 31, 2018","steve_h"
"955","5.0","Aurora Yellowknife . I joined 2 tours for Yellowknife. Before I think this company is quite trouble. Because it need phone confirmation rather email confirmation. I hope they can improve that. Besides, Arctic this one is excellent. Wiley is the driver & photographer & with one taiwan working...","November 19, 2018","kamocot"
