"attraction_id","rating","review","review_date","user"
"604","1.0","What a Joke!!!!!!!!!. So I booked the Fraser Valley wine tour on January 19th, paid in full that same day. The tour was scheduled for June 17th, and in the months prior I called to ask which wineries they planned to go to...…they said they wouldn't know till...","June 29, 2018","kldsandiego"
"604","5.0","Great way to spend a Wednesday!. Took the Fraser Valley Wine Tour with Scott and had a REALLY lovely day! The choice of wineries was great, Township 7 was my favorite, but Vista D'Oro really gave you your monies worth. Scott was an excellent tour guide! Really enthusiastic and knowledgeable about...","June 22, 2018","freshface007"
"604","5.0","Outstanding Fraser Valley Wine Tour! Highly Recommended!!!. I thoroughly enjoyed my day in the Fraser Valley; Maria was the perfect tour guide. I had no idea that there were so many outstanding wineries so close to the city.\nOur first stop was at Backyard where we were treated to a behind-the-scenes tour,...","June 4, 2018","crepelike"
"604","5.0","Had a great time!. Took the Fraser Valley Wine Tour on May 23 with Scott and had a great time! He is very knowledgeable about the area and took an interest in what we each had planned while in Vancouver. We visited Backyard Vineyards, Township 7, and Vista D'oro....","May 31, 2018","erinvc"
"604","5.0","Fabulous Beer Excursion . We had a fantastic time visiting 3 breweries. Maria was so knowledgeable (and fun), she made the experience very memorable. Highly recommend.","April 25, 2018","activegirl9"
"604","5.0","Wonderful day with Scott. The tour was excellent. We visited 3 lovely wineries. Sampled a variety of varietals. Scott was not only a great driver but also had a vast knowledge of the wine and wine making process. I would recommend this tour to anyone out to see what...","April 21, 2018","danfredusa"
"604","5.0","Awesome trip! Great wine. Had such a good time with our group and our awesome guides Ben and Scott! They made it super fun, especially since I went on the trip by myself. Would highly recommend :)","March 30, 2018","ashleighp132"
"604","5.0","What a treat in my own back yard!. To celebrate our three January birthdays, our small group of friends got together for a wine tour to the Fraser valley this past weekend. We had all done wine tours elsewhere - Napa Valley, Saltspring Island, France....In fact, my family has a small, private vineyard...","March 12, 2018","cynthia_b"
"604","5.0","Great addition to a trip to Vancouver!. We had a great time on the Fraser Valley wine tour. Our guide Oliver and guide-in-training Helene were great company and very knowledgeable about the region. We visited three wineries, tasting wines at each and had a delicious cheese and charcuterie lunch at one of...","October 19, 2017","salinatraveler"
"605","5.0","Great day of wine tasting.. Our tour guide Harold picked us up at our hotel right on time. As we traveled from Niagara Falls to Niagara on the lake he kept us well entertained by his local knowledge of the area. He had a list of wineries we were to...","February 18, 2019","kevinlhenderson"
"605","5.0","A day in Niagara. If you're trying to decide what to do in Niagara and you enjoy wine...we enjoyed a good 5-6 hour day with our guide, Bernie, and we had a fabulous day!! We booked on line and the whole excursion happened seamlessly! Canadian wine was an unexpectedly...","November 25, 2018","carol_w"
"605","5.0","Fantastic day. First class service. Darrel picked us up directly from our Airbnb. Very professional and knowledgeable, took us to some really nice wineries. We had a great lunch at The Garrison, one more wine tasting then back home. What a fantastic day and tour! Didn’t have...","October 30, 2018","781edwardm"
"605","5.0","Wonderful Day of Wine Tasting!. Bernie picked us up promptly at 10:25 a.m. at our hotel and it was clear from the start that we were in for a treat. Being a local, Bernie knows so much about the area and shared with us a ton of great information. We...","July 11, 2018","tracyt0428"
"605","5.0","Great Attention to Detail. Breanne did an amazing job as our tour guide. We went through on Saturday the 3rd of February and she lead a group of 12. My wife and I enjoyed the experience very much. The ice room was a special treat. (30,000 pounds of ice...","February 5, 2018","jvuser"
"605","5.0","Great wine and great experience!. We had a great time on our wine tour of Niagara On The Lake. Daryl, our guide, was a lot of fun and he knew the area well. He had great suggestions for wineries to visit based on what we liked and he was flexible...","November 14, 2017","marc_h"
"606","5.0","So full!. I was only in Toronto for a few days and I knew I was going to spend the $$ on food. Glad I did this tour as I not only got to eat...a lot, I also now have a great go-to list for top spots...","January 12, 2019","jessica_s"
"606","5.0","Great tour. My daughter and I really enjoyed this tour,on our own, we never would have known where to go or what to try. There was an incredible amount of variety, SO much food, and we had some choice in what we wanted to try. Our guide...","October 26, 2018","barb_d"
"606","4.0","As promised, you won't walk away hungry. The Chinatown tour focused on bakeries and eateries that bake/cook Cantonese style food. The two bakeries were fascinating. Cafeteria trays and tongs were the implements to select from the many offerings. We ate a baked pork bun (versus steamed) and a fresh spring roll that...","August 20, 2018","oh_traveler3"
"606","5.0","Great time! . We had a great tour of old Chinatown with chef Kelly! She was friendly and knowledgeable and kept things moving at a good pace for our group. We ate delicious food (more than we should have!) and she customized the selections for our preferences which...","August 17, 2018","nispero_zapote"
"606","5.0","Delicious Way to Explore Chinatown. I went on the Old Chinatown Food Tour at the beginning of July and really enjoyed it! We stopped at several places and tried so many different foods. The tour included both quick bites and sit-down meals. Our tour guide, Ariel, was awesome. He’s really...","July 18, 2018","annatravels4"
"606","5.0","Great way to experience Chinatown. My two teenage boys and I enjoyed our tour with Chef Scott. His knowledge of Chinatown and the history of the area was great but we also enjoyed his personal stories. He took time at the beginning of the tour to see how adventuresome we...","April 6, 2018","kazoofamily"
"606","4.0","You want this. Yes. You do. . So Chef Scott delivers on his promise, you won't leave hungry.\nDelicious Toronto Chinese food, including the hidden gem Chinese bakeries, a local favorite late nite hot spot and an in-the-know delicious dim sum. Again, trust the Chef... would never find these places on my...","April 6, 2018","soulvoyager"
"606","5.0","""Great Tour, Excellent Guides, So Much Food"". Let me begin by telling you if you are looking for sample portions, this is not that tour. My wife and I recently took this tour with Chef Scott and a new employee (sorry cannot recall her name). To begin with both of these individuals...","April 6, 2018","frederickwilliam"
"606","5.0","Delicious and interesting!!. My guide, Charles, was fantastic, and the tour was great. I ended up being the only person on the tour that day. Charles has a lot of knowledge and history about Chinatown to share. The food at each stop was delicious- especially the savory crepe...","March 19, 2018","booknook21"
"606","5.0","Good food, good time. Our guide, Chuck, was very knowledgeable about the food and the community. We enjoyed the food and conversation. Highly recommend this tour.","March 12, 2018","david_b"
"606","5.0","Enjoyable even in the freezing cold!. We had a wonderful time on the Chinatown tour, Our guide was very friendly and made sure that we learned a lot and also got to sample a little bit of everything. We really enjoyed the Chinese bakery stop and the Dim Sum was great...","January 14, 2018","966erind"
"607","5.0","Great tour. Dave picked us up at our hotel and took us to West Kelowna for a tour of numerous wineries Each provided us with 5 samples and Dave supplied some crackers and cheese at one winery Very informative and no pressure to purchase wines although we...","October 3, 2018","tome289"
"607","5.0","Very relaxed trip with great tour companions. We decided to make the tour with Red Dog the evening before we went on it. Booking, pick up at hotel and overall organisation were all great. We visited 5 wineries for tasting and another to take in the views on what was a beautiful...","September 24, 2018","bill_t"
"607","5.0","Great Tour with Great Tour Guide. Nice afternoon with Dave.\nGreat tour and nice winery’s.\nEven I’m not a wine drinker and made the tour four my wife I really enjoyed it and found also wine I like.\nA must for everybody who stays in Kelowna.","September 17, 2018","koppa-s"
"607","5.0","Brilliant day out. After being highly recommended by the staff at our RV site we booked the afternoon wine tasting experience with Dave from red dog wine tours. We got picked up from our site which was perfect. On the tour we stopped at the following,\nOff the...","September 15, 2018","jamieturner72"
"607","5.0","Red dog wine tour. What a great way to spend a cloudy day...... testing wine. Was a great day and so many wonder wines to try. Our guides where super great. Highly recommended red dog tours with Dave and Michelle","September 14, 2018","rhonda_o"
"607","5.0","Good wine. Great afternoon visiting 4 excellent wineries. Pick up from hotel. Host John made the tour interesting by giving us information about surrounding area. Recommended restaurant for eats later that evening. Thanks.","August 25, 2018","1821jt1922"
"607","5.0","Red Dog Wine Tour. My girlfriend and I went on this amazing wine tour. Thank you to Dave for making sure we had an amazing time but most of all made sure we were comfortable and well entertained. Dave was super sweet, well knowledged and he even brought snacks...","August 22, 2018","arjun_s"
"607","5.0","Excellent Kelowna Wine Tour. My boyfriend and I really enjoyed the afternoon Kelowna Wine Tour. Dave was an excellent host, and had lots of great information about the wineries and Kelowna itself. We had a little bit of extra time on the tour, so we were able to make...","August 20, 2018","jasmine_n"
"607","5.0","Great tour, highly recommended! . John was a great host, he took us to 4 very different wineries, and was quite knowledgeable about the industry and Kelowna in general. We'd do it again if we're back in the Kelowna area.","August 17, 2018","jennifer_r"
"607","5.0","Wonderful Tour!. Dave was a fantastic host for our Kelowna afternoon wine/sightseeing tour. We were picked up right on schedule from AirBnB so didn't have to worry about a thing. Dave was very knowledgeable about the wine's we were sampling as well the Kelowna area. He pointed...","August 15, 2018","chriss12799"
"607","5.0","Great Afternoon out. Really enjoyed our afternoon wine tasting the Hatch was a really interesting Winery with great wine.\nWe bought Wine at three of the wineries Quails Gate the was a great place with a good restaurant and fantastic views over Lake Okanagan.","August 12, 2018","fergus_t"
"607","5.0","Great Tour!. We had a great time on this tour. Great selection or wineries with a knowledgeable host. I would recommend this to anyone visiting the Kelowna area.","August 7, 2018","aaron_c"
"607","5.0","Amazing Afternoon!. We chose the ""Kelowna"" route with Red Dog as it offered a selection of vineyard that we had not visited. Dave and his team were excellent from booking all the way through return transportation.\nThe communication was clear and the pick up was on time....","August 7, 2018","victoria_r"
"607","5.0","Great tour. Excellent service and staff.. We recently did the Kelowna option of this tour with Red Dog. Picked us up right in our hotel lobby. The driver we had was very knowledgeable of the area, very friendly, and very helpful. He went above and beyond and made it a great...","August 1, 2018","yukonperson"
"607","5.0","Great way to spend a Saturday . Spending the afternoon with them was great! Super knowledgeable about the area, great sense of humor, and even fed us cheese, crackers, and chocolate along the way. Dave was also quick to pre-cool the shuttle for us all prior to getting back in, which on...","July 28, 2018","missnjp"
"607","5.0","NIce and relaxed tour with a comfy bus and friendly guide. Red Dog tours was responsive, easygoing and pretty fun. We got picked up at our AirBnB which was pretty far out of town. The van arrived early and we were on our way. There were 4 in our group, and 2 others joined us for...","July 18, 2018","rob_e"
"607","5.0","West Kelowna winery tour - a glorious afternoon!. A first winery tour for us - and it was awesome! David and Michele were great hosts - friendly, helpful, and went beyond. A relaxing afternoon - a good introduction to winery country. We would recommend to anyone visiting, or living here - who would...","July 7, 2018","linda_m"
"607","5.0","variety of wineries. Had a great afternoon on the wine tour with Dave, he is extremely knowledgeable about the region and took us to a variety of wineries from small organic to large scale modern. It was a fun filled afternoon with cheese, crackers, chocolate and wine, what...","July 6, 2018","ruby_s"
"608","5.0","We loved Carrie!. Despite a major snow storm and terrible driving conditions, our tour guide, Carrie, was calm and careful throughout our journey and we had a very stress free and relaxing time visiting wineries we have not been to before. She was knowledgable and friendly and I'd...","January 21, 2019","rebecca_f"
"608","5.0","AMAZING . John our tour guide was absolutely amazing . He was very knowledgeable, down to earth and knew how to have a great time. My wife and I ( Bill and Vicki) will be back with another couple for another tour.\nHighly recommended and will tell...","November 18, 2018","billsy5353dp"
"608","5.0","Great tour and wine. We did the afternoon wine tour with Denis. He was a great guide and told us lots of local information (it was our first trip to the area).\nWe were lucky in that it was only the 2 of us on the trip.\nHe was...","October 5, 2018","tania_d"
"608","2.0","Dehydration tour. Dehydration tour done on sept. 15 2018. This tour is VERY overpriced and was very disappointing.\nFirst off when you get to 443 Butler St. for your pick up there is very little parking and no bathrooms and it's difficult to find what entrance to...","September 17, 2018","anna_f"
"608","5.0","Highly recommend a wine tour. My husband and I enjoyed an excellent afternoon tasting wine and touring a winery. We were visiting the area for our anniversary and my husbands graduation. We had never been on a wine tour before and were thoroughly impressed. Our driver ,John, was so friendly...","June 15, 2018","paulnicolefamily"
"608","5.0","Great Experience. We went for Valentines Day and it was amazing. Loretta was very friendly when we met her she took the time and effort to really explain the history of each place we went to, she also related to us to make great conversation and went...","March 22, 2018","jordanna_m"
"608","4.0","Great day, very dissappointing ending. My family and I went on the Wine and Cheese tour this past October for my 21 birthday. We had never been on a tour before and we were very excited about the day. Our tour guides, John and Toni, were awesome. Very friendly, nice,...","December 7, 2017","bradford04"
"609","5.0","Fabtastic. Never been a wine tour before and was told it’s a must when visiting the area. Booked this not knowing if it was our thing. Absolutely loved it. Melissa was our guide and she was bang on time and kept us entertained. We visited 4...","July 11, 2018","roxysoxy1"
"610","5.0","Awesome way to spend a Saturday afternoon. This craft beer tour was a lot of fun. We went to 3 very different breweries and got to taste 4 flights from each. Our tour guide was very knowledgeable and friendly and gave us a thorough explanation of the brewing process.If you are interested...","February 11, 2019","kellyhancock8"
"610","3.0","The Beer was delicious!. I received this as a Christmas present, so my friends and I recently did the West End Tour. I was rather underwhelmed with the entire tour. Maybe it was the timing, as we did the 6:00 PM tour on a Saturday, but it didn't really...","February 4, 2019","jangan"
"610","5.0","Great way to spend a Saturday afternoon in the dead of winter!. I just did this tour with a few friends (east end) and we had such a great time. We normally participate in RunTOBeer with Dan which is what prompted us to register for a tour with him. Everyone on the tour was friendly and each...","January 28, 2019","vklugman"
"610","5.0","Very friendly and knowledgeable. I have never done a brewery tour before but the tour guide was friendly, very knowledgeable and highly interested in beer. The tour was very easy to book and ran on time with no hassles. We did a west end tour and there were no...","January 6, 2019","843mathews"
"610","5.0","Excellent night out. Had a great tour with Matt on the 4th January 2019. Thank you Matt all your beer knowledge and the places we went. Definitely keep Shacklands on the list they are an awesome place. Cheers from Perth, Australia.","January 6, 2019","maureen_k"
"610","5.0","Great Time!!. Lots of fun! Enjoyed the stories and history of the Breweries. Our driver Jelena was fantastic and made our tour extremely enjoyable. Learned a great deal about beer and discovered several new ones we will be enjoying from now on. The staff at the breweries...","January 6, 2019","madhatter3737"
"610","5.0","Absolutely Worth It!!!!!. My friend Steve and I did the 'East 'end tour as he received it as a gift for his birthday and I tagged along. Best decision I've mad in months lol\nWe were picked up on time (we were to meet at 11:45) at Woodbine...","December 30, 2018","hungrytarheel"
"610","5.0","Birthday tour . Reece at Henderson’s was amazing he was very friendly and very knowledgeable! Loved all the beer 🍻 Peoples Pint brewmaster was so informative about flavour profiles and down to earth friendly highly recommended both these establishments!! Rain hard was a disappointment for the last brewery...","December 17, 2018","patricko967"
"610","5.0","Fun Event. Went for a friends birthday it was very fun. The tour guides were friendly and informative and we got to sample a wide variety of beers.","December 14, 2018","lightpacker287757"
"610","5.0","Amazing time with Toronto Brewery Tours!. We celebrated my husband's 50th birthday by scheduling the west Toronto tour and it was great! Our beer captain Dan was friendly, professional and knowledgeable. Everyone in our group raved about the experience and appreciated the variety of breweries offered. We highly recommend this tour...","December 9, 2018","ukie2010"
"614","5.0","Great Host. Fun & Exciting Trip. Our Host was Natahan, and he was a real Gentleman. always made sure we watched our step, and offered umbrellas for the Rain!\nThe falls look out point was great, as was the village.\nDidn't try the wines, but the other...","March 15, 2019","amyleestarr"
"614","5.0","Great Tour company. Tour was great. Really wanted to take the helicopter ride but it was cancelled. Niagara on the lake was smaller than we had imagined.\nAll in all, good choice for the money","March 1, 2019","heidi_m"
"614","5.0","The Best Tour to Niagara Falls. I would commnet these folks for perhaps giving us not on the best tour, but the most professional service. Would love to use them again in the future. Big shout out to Stephen for making our day memorable and for the good laughs.\nMy wife...","February 28, 2019","jeffandmary74"
"618","5.0","Wonderful cultural experience. Despite living here for 30 years, I didn’t know Chinatown or it’s history until this Wok about. So happy to have out of province guests to prompt us to experience what is on our doorstep.\nFabulous 4 hours in the garden and streets/restaurants. Guide Susan...","February 6, 2019","brenda_w"
"618","5.0","What a great experience!. I’ve lived in Vancouver for four years now and never really ventured out to China town. But Bob integrated the tour with so much knowledge, and my I really enjoyed eating the different foods that I haven’t experienced before. The garden where the tour starts...","January 6, 2019","kygee9"
"618","5.0","Chinatown: a cultural and gastronomic oddessy indeed.. My wife and I have lived in Vancouver for over 25 years and thought we had acquired a good knowledge of all the local sights and history .. wrong: a four hour walking, chatting, visiting and eating tour with Bob Sung opened up a whole...","December 30, 2018","towser71"
"618","5.0","The perfect host for a fascinating tour of Chinese culture and food. As others have stated, Bob Sung was both knowledgable and thorough. He integrated Chinese philosophy and food in a way that explains so much about Chinese culture. He was both pleasant and an inquisitive person. He was a fabulous listener, wanting to glean as much...","November 2, 2018","jaybonner"
"618","5.0","A true WOK around Chinatown. Bob Sung was both knowledgeable and pleasant. He made the tour educational, fun, and interactive. I learned so many things. The apple tart at New Town, a CNN place to eat was fantastic. The Dim Sum lunch was fantastic. His knowledge of Chinese culture and...","October 15, 2018","vacation620703"
"618","5.0","Wonderful thing to do in Vancouver. Just retuned from a 3 day visit to Vancouver. We were a party of 4 and learned about this tour from the concierge at our hotel.\nIt was a memorable experience and all of us really enjoyed the tour very much.\nBob Sung is a...","October 14, 2018","rfreedman1572"
"618","5.0","Fabulous way to tour Chinatown!. I would highly recommend this tour! Bob is a fantastic guide and I came away from this tour knowing so much more about Chinese culture and history. The food is delicious and the Chinese tea demonstration was unique and a delight. This tour will leave...","October 7, 2018","tnv0ls"
"618","5.0","Great tour, even for Vancouverites!. Bob's tour is terrific. As a local who wants to learn more about Chinatown, it was very educational and I learned a tremendous amount about Chinese food and culture. Highlights for me were the traditional garden, the dim sum lunch and the stop at the...","September 23, 2018","rennie_b"
"618","5.0","Wonderful, flavorful tour!. One of the best days of our 10-day trip! We started in the garden and even though it was raining, we were able to find the beauty in the plants and art, thanks to Bob's knowledge of the Chinese culture. The garden sparkled and I...","September 19, 2018","mlasto4"
"618","5.0","Different, cultural, and delicious!. Bob was our guide for this Chinatown visit. It included the Dr. Sun Yat-Sen Classical Chinese Garden, as well as visits to a bakery, produce markets, butcher shops, and herbal medicine shops with taste sampling along the way. We finished with a delicious dim sum...","September 14, 2018","linda_a"
"618","5.0","An Amazing Four Hours. We were guided by Susan Ma and she was so knowledgable. We spent about an hour in the beautiful Dr. Sun Yat-Sen Gardens, and then ambled into Chinatown, visiting several stores, learning about the history of the early immigrants, and sampling food. Then we met...","September 3, 2018","nc_eddiej"
"618","5.0","Awesome tour with Bob!. The tour was great! We learned a lot Chinese culture through food, garden, Chinese medicine and tea! Bob was an awesome guide and we had a lot of fun! Dim sum are the best!","August 24, 2018","fcmorency"
"618","5.0","Great way to start off a visit to Vancouver. My wife and I wanted something low key when arriving in Vancouver at 11 pm. We got up the next day and did this tour at 10 AM. Bob started us with a personalized tour of the Sun Yat Sen cultural center and then took...","August 21, 2018","ansgenius"
"618","5.0","A Wok Around Chinatown. Bob was just excellent; so knowledgeable and friendly and knew how to take our personal backgrounds and interests and relate them to the various points of the tour and Chinese cultural history. Really fantastic.","August 20, 2018","seth_l"
"618","5.0","Robert is a wealth of knowledge!!. Robert is knowledgeable, funny and warm.I would recommend this tour to everyone!\nHe took a great detail of time teaching us history, culture and culinary concepts in such fun ways that time with him passed so quickly. The food tasting and lunch were excellent but...","August 20, 2018","sue_b"
"618","5.0","Definitely recommend this tour. a fantastic experience. The guide was knowledgeable, friendly and went out of his way to personalize the tour. a good value for the money as well.","August 14, 2018","sean_p"
"618","5.0","All four of us thought it was a great tour.. Bob gave us new and interesting info, about Chinese history in the Northwest. We ate a lot of really good Chinese food! I would recommend this tour for anyone who likes Chinese food. Bob was accommodating to one participant who was vegan, but I don't...","August 14, 2018","coreen_h"
"618","5.0","Authentic time in Chinatown. Bob was very knowledgeable and interested in personalizing our experience. We were the only two on the tour which was nice. He gave lots of background information, got to know us, chose food he thought we would enjoy. There's not too much walking. I loved...","August 13, 2018","wittywhit211"
