"attraction_id","rating","review","review_date","user"
"971","5.0","exillerating. walking on a glacier, how many people can say they have done that! It was amazing, weather was awesome, the experience is worth every penny.","June 18, 2018","saurman2018"
"971","5.0","Spectacular Tour. We had an absolutely fantastic trip to the Athabaskan Glacier with our very friendly and knowledgeable Irish tour guide, Ed. With his love of natural history and wildlife, Ed made it an experience that we will never forget. We stopped at many incredibly scenic spots...","June 17, 2018","stan_s"
"971","5.0","Very helpful for last minute itinerary changes.. The folks at Discover Banff Tours were very helpful to make last minute change on the tour we booked for the Icefield tour from Lake Louis. It all worked perfectly for us and the tour to Athabasca Glacier is wonderful and highly recommended.","June 10, 2018","jeff_l"
"971","5.0","Ice explorer ride to Athabasca Glacier. Our tour guide Peter from Nova Scotia was excellent, low key, knowledgeable comments, with lots of humour to entertain a mixed group on our Tripadeal tour. Would highly recommend him to travellers.","June 9, 2018","jenny_g"
"971","5.0","A memorable day with Anick. Every minute spent with Anick was like spending time with your favorite teacher. Her love and respect for nature and for Canada was infectious. We learned so much about a variety of topics and came away with a deeper understanding of the beautiful Canadian Rockies....","June 6, 2018","wer3mcds"
"971","5.0","All the knowledge the tour guide gave us of the Lakes and topography. Our tour guide who was very quick wit and very spunky. I can not remember her name. She slowed down the van on the way back from Bow Lake when she spotted a black grizzly bear. She backed the tour van up and gave everyone...","June 6, 2018","eric_b"
"971","5.0","Just got back from the all day Columbia Icefields Parkway tour.. Oh my, what a great day. Our tour guide from Ireland, Ed, was so knowledgeable and personable, he really made the day enjoyable. He even “arranged” for a sighting of three black bears and one grizzly, rain, snow and sun all at the right times,...","June 4, 2018","jdtrvl"
"971","5.0","Just Do It!. Where else in the world can you drive onto, and then walk on a glacier, in safety? Certainly here is a MUST DO activity. We were part of a touring group, and 16 of us chose to do this activity, and were not disappointed. The...","June 1, 2018","dobbo_13"
"971","5.0","Day tour. Had an awesome day\nSaw 3 bears\nNorm was an excellent guide\nLunch was yum also\nGreat day out\nGreg & karen\nAustralia","May 31, 2018","gjboyle66qwertyu"
"971","5.0","Highly Recommended. This was an amazing trip, with not only getting to see some of the amazing glaciers of the Canadian Rockies on the trip down the Mt Athabasca and then go on the glacier itself, but also gain a great deal of area history and if...","May 29, 2018","travellert2016"
"971","5.0","Amazing Trip To The Glacier !. This was an amazing trip to the glacier! It is worth taking this tour just to see the scenery on the way there and back, however the trip also included multiple stops along the way to see different sights which is a bonus. The guide,...","April 29, 2018","sherri777"
"972","5.0","Perfect for non-skiers who still want a little adventure . My fiancé and I always look to do something on the adventurous side when we go on vacation, and we decided to book this trip since we are not skiers! We wanted to go up on the mountain and enjoys the snow-views without having to...","March 2, 2019","adrianalum"
"972","5.0","Make your own tracks in the mountain. I met the guide at the top of gondola. Sam was friendly, helpful, and clearly loved introducing everyone to backcountry snowshoeing. It was glorious. But also strenuous. I'm not in great shape but I was pretty grateful for all the squats I've been doing since...","February 17, 2019","yycsullivan"
"972","5.0","Great snowshoe adventure. Took advantage of this tour being offered to attendees of the Keystone Symposia conference held in Banff. We walked in the forest of the Vermillion Pass that forms the continental divide between Alberta and British Columbia. Our guide, Alex, kept us well entertained with stories...","February 16, 2019","prairieflats2"
"972","4.0","A Christmas Eve to remember. Our first time snow-shoeing, it certainly was a memorable experience. The ride up in the gondola was beautiful and then to be walking around in deep powdery snow on top of the world was unforgettable. Especially when our guide had to stay back to assist...","February 5, 2019","beckoz"
"972","5.0","Best Day. My husband and I were keen to get to the mountains without skiing on this short stay in Banff, and this tour was the PERFECT activity for us. We had the most incredible weather on the day, sunshine and dry snow - which made everything...","January 15, 2019","2786jessie"
"972","5.0","Fantastic even on a cloudy day!. My fiance and I had a great time this past weekend doing this snowshoe tour. It was a fantastic way explore the mountains, and even though we didn't get the classic moutain views because of the clouds, the adventure in this tour made up for...","January 29, 2018","karlene_m"
"972","5.0","Another great snowshoing experience. We just completed another great snowshoeing experience at Sunshine. Our guide was Magda, who is always very informative and friendly. With her help we enjoyed an amazing experience. The trip itself was not too strenuous ,with frequent rest stops, amazing views. Don't forget to bring...","January 28, 2018","jim690"
"972","5.0","Unbelievable . We have just returned from this snowshoe trip and it was fantastic. Mixed group of ages and some degree of fitness is required, but the guide Marc adjusted the speed of the trip to suit everyone.\nMarc ( the guide) was very informative from the...","January 13, 2018","dazjuls"
"972","5.0","BEST day snow shoeing ever. From the moment I got into the van I knew I had picked a winner.\nMel our tour guide was welcoming and fun and full of information on the walk.\nThe trip up in the gondola was great but paled in comparison to the backcountry...","January 12, 2018","stephonholiday16"
"972","5.0","Exhilarating and Exciting. Amazing adventure and 100% RECOMMEND! You def need some conditioning to participate so prep with some cardio and legs before. We came from Sea level to 7K feet above and the adventure was a nice challenge and worth every minute!!! Thanks to Julia for helping...","January 7, 2018","honest_t"
"973","5.0","Great introduction to winter outdoors. We were collected from our Hotel by Alex. Turned out we had just one more person with us so was a great small tour group. Maybe the - 23c put some people off. Alex was great full of stories and knowledge about the areas we...","February 17, 2019","mark_c"
"973","5.0","Awesome time in spectacular winter wonderland. Our tour guide Maggz really made the trip to an already spectacular place that much better. She was very engaging and funny, knowledgeable about the history and geology of the area, and passion for the local wildlife. The scenery was unparelleled, the ice sculptors at...","January 23, 2019","kylerohde"
"973","4.0","Winterland Tour. Tour was well run for the first half. Itinerary states 'easy walk' along the edge of Marble Canyon - it is more difficult than we expected even with the cleats attached to our shoes - slippery and scary staircase to walk up and down. Guide...","January 22, 2019","cruiser0910"
"973","5.0","Amazing!. This was my favorite tour we did the whole 8 days we were in Banff! If you get a choice of guide, Maggz is the way to go! Never met a more amazing tour guide, she was so knowledgeable, and suoer enthusiastic, unlike many tour...","December 30, 2018","jessemcjannett"
"974","5.0","Great experience. Fun for all ages.. Great operation. Picked us up at our hotel and took to a property. 20mins from down town Yellowknife.\nThere is a comfortable indoor waiting area with coffee and snacks. There are 2 ppl per sled and you can ride and drive. The dogs are happy...","February 18, 2019","stephen_d"
"974","2.0","Dog sledding tours by Arctic Tours. I booked Artic Tour product because it's linked to TripAdvisor. What a big surprise !\nThe Tour guide hardly spoke Englsh. We had to wait around 15 minutes outside while the tour operator prepared the sleigh. They stuffed the sleigh with some kind of cloth...","March 9, 2018","indra_o"
"974","4.0","Very good experience.. This is my first time and I enjoy it very much. I hope that the dogs could run in the forest, that should be very beautiful.","January 22, 2018","luosha_l"
"974","4.0","Something that you didn't know that you always wanted to do.. We went Christmas week and so have to make allowances for the crowds but even so it seemed a bit dis-organised. Not much direction on where the office was and how to get ""booked in"". (we were a group of 4 at a time when...","January 3, 2018","michaelfane"
"975","5.0","Great tour with local entrepreneur . Ryan did a great job balancing interests... nature skiing, sports, history, local news. We got to spend 30 minutes in Function Junction where I got a fantastic coffee at Camp and incredibly good bread and pastries for Valentine's Day at Purebread. We saw a bobsled...","February 14, 2019","johnste"
"975","5.0","Intro to Whistler for us. Ryan provided us an excellent start for our stay in Whistler. His overview was informative and was presented in a friendly and factual manner. He explained the history and showed us many of the sites that we were to see later on in our visit,...","February 11, 2019","rickeyg2018"
"976","5.0","Worth the trip!!!. Take at least 4 hours, walk the way from the car park and observe how disling fast the gletsjer is melting down.\nObserve the time markers and feel the vibes of a wonder of nature.\nYou will leave the place very impressied and quiet.","January 6, 2019","theofiel"
"976","4.0","20 minutes on the Glacier or you'll be left behind.. We had a great time travelling to the Glacier in the huge purpose built buses - what an experience in itself! On the Glacier - we were told only 20 minutes on the Glacier and that is all you get. If you don't return to...","December 11, 2018","karen_b"
"976","5.0","DrandMrsB_BrewsterTour. We were blessed to have been assigned to Louie and Rick's bus. Both of these guys were tremendously helpful, knowledgeable, and organized throughout the entire day. Even with a slight schedule delay due to wintry conditions, they kept us informed and entertained. They pointed out...","October 26, 2018","jeff_b"
"976","5.0","Fantastic. A wonderful tour, especially as there were very few people on the glacier.\nMade all the better by our driver, Pat and courier Lauren","October 12, 2018","peter_h"
"976","3.0","Didnt get to enjoy. Travelled from hinton to the discovery centre 3 times with tickets but due to the weather it was cancelled everytime so we got a refund just disappointed that each time they didnt state it on their website and each time i called they didnt say...","October 4, 2018","d5343pmdonnam"
"976","5.0","Fabulous. Used this tour as a transfer from Banff to Jasper and what a day. Sunny with blue skies, so many sights, breathtaking scenery and so so many photos, all made better by our excellent guide George and the driver (sorry name forgotten). The information given...","October 2, 2018","clive_s"
"976","5.0","Great Excursion. Enjoyed our excursion to Columbia Icefield and Glacier Skywalk in September. Tom was our guide and was very knowledgeable & super friendly. Also enjoyed the Peyto stories and maple syrup biscuits. Brilliant scenery stops. thank you for a great day Tom.","October 1, 2018","deb_g"
"976","5.0","Disney . Our trip up to the Glacier and walk on it was awesome and can’t say enough about our driver/guide, Andrew! Highly recommend.","September 21, 2018","tony_d"
"976","5.0","Great experience.. We booked up the combined Athabasca Glacier and Skywalk tour before we left the UK and were very lucky with the weather. My husband is not keen on hieghts and was very nervous, there is a viewing area that doesn't have a glass floor but...","September 20, 2018","amanda_l"
"976","5.0","Excellent Experience. We are not fond of packaged tours in general, but this tour really is a wonderful way to see and learn about the area in a comfortable and friendly way! David, our driver, was friendly and full of interesting information and anecdotes about the area....","September 19, 2018","travelers2013"
"976","5.0","Amazing Tour!!!. This tour exceeded all of my expectations and even though the weather wasn't entirely ideal in the beginning, our tour guides, Al & Jade (who are phenomenal and such a joy to be around btw!) made it an enjoyable experience overall. Will definitely book with...","September 19, 2018","estefani_o"
"976","5.0","A must do!. This is a great experience to walk on the glacier. It is a very well organised with safety a major factor. Fun to go on the snocoach with our experienced guide. Restaurants available for meals and snacks.","September 17, 2018","789sallyp"
"976","4.0","Call it a Day. We went to the skywalk only as we had done the icefield many years ago. To do both is $99 per person.\nThe skywalk took close to two hours by the time you wait to pay then wait for the bus both directions. It was...","September 17, 2018","fiesseld"
"976","5.0","One amazing day! Loved it!. We were picked up at about 7.30, from our hotel in Banff, to do this way way tour to Jasper. Our driver’ Alan, and the courier, Jade, were very well organised and made us feel very welcome.\nWhat a fantastic trip! Stunningly beautiful scenery all...","September 16, 2018","skilli15"
"976","4.0","Columbia icefields and skywalk tour from Banff. Kudos to Murray, our driver: Hannah, his assistant; and Rusty the snowcat driver. All we're very knowledgeable and engaged. The ride was wonderful; and the icefields eperience was awesome. We got snowed and fogged out for the skywalk, but that is okay. Another time. A...","September 13, 2018","pammillerb4"
"976","2.0","WAY overpriced and underwhelming. Pay a couple hundred bucks. Reserve a time, then wait in line. Get on a tour bus for a five minute ride to another bus terminal. Get on another bus (yes, it has huge tires and looks really cool, but let's face it...it's another bus)....","September 12, 2018","scottsiddall"
"976","5.0","Perfect day visiting Columbia Icefield & Glacier Skywalk. Early pickup, but so worth it! Our experienced tour guide Al & assistant Juno had tons of knowledge, as well as passion for the mountains & animals. Their knowledge & love amplified our wonderful experience. Perfect weather after smoke from recent fires, was heaven sent....","September 11, 2018","928madgek"
"976","5.0","2018 Canada Family Vacation. The tour takes a bit of time but well worth it! Going up to the glacier was very interesting, you are not there long but that is ok. We then went to the skywalk which was fantastic! Be sure to do both when you visit.","September 5, 2018","jjantech"
"976","5.0","Great Tour with excellent guides. Really great tour from Jasper with driver Andy and guide Danielle. Andy gave a great commentary and so much information that it's difficult to remember, he stopped every time we saw a bear or mountain goat. The ice field was a visit to be remembered....","September 4, 2018","caraman13"
"976","5.0","Amazing lifetime experience conducted by a professional tour company. Took this tour conducted by Brewster. Very well organized and the attention to details was just perfect. The whole experience of driving through the icefield parkway, watching the towering mountains on both sides filled with glaciers was spell binding. The lake peyto was like something...","August 30, 2018","manoj_varadarajan"
"976","5.0","Wonderful Day on the Columbia Icefield and Skywalk. We bought this tour as a package to save some money. This did not disappoint! It was very crowded in the restaurant and fast food places but the lines moved quickly. Our lunch was very good. We recommend the chili. The tour was running behind...","August 27, 2018","teacher2800"
"976","5.0","Amazing experience. We took this tour in August 2018. Yes, it is not cheap, but it is TOTALLY worth it. The guides were amazing, especially our snowbus driver Rusty. So much information to give in such a short time, and they do it easily, with good humour....","August 27, 2018","olga_k"
"976","5.0","See it b4 it goes. Huge vehicles well worth the visit, there are many ice fields but this is the one that you can actually go on","August 23, 2018","david_f"
"976","5.0","Brewster know their stuff. . We did the Columbia Icefield as well as a separate trip up the Banff Gondola and tour of the area and transport to Calgary.\nBrewster worked in conjunction with the Rocky Mountaineer providing the above tours as well as transport to hotels. They were prompt,...","August 13, 2018","grumbor"
"976","5.0","The Best Experience in Banff. I along with most folks in our group of 10 rated it as the best experience we had in Banff. The driver cum guide Murray is very knowledgeable and answered all our questions patiently. We could see that he is really enjoying his job. John-lieu...","August 5, 2018","kuriappan_a"
"976","5.0","Great tour and views. We pre booked this tour from the Uk and it was certainly well worth taking a day off from our fly-drive holiday to give everyone the chance to admire the views without worrying about navigating and staying on the right sid elf the road. Driver...","August 5, 2018","angela_r"
"976","5.0","a well organised tour. Very impressed with the quality of this trip. We did it end of May from Banff.\nGood quality coach, several stops of key interest, amazing geology. Only the one to Peyto Lake could not be reached due to late snow on the road.\nThe driver,...","August 2, 2018","sonoscozzese"
"976","5.0","Awe inspiring glacier and lakes. The tour was so well organized and the driver David and guide Haley took such good care of us. Tour was packed with so much covered in 1 day, not possible to do it on your own in a day.\nWould have loved to spend...","August 2, 2018","vancouverpatel"
"976","3.0","Good for 1st times who does not want to drive. Most of the whole day trip was used up by the travel time on the road. Lake Louise and Peyto Lake was time constrained, 20 minutes each including the trail walk which was not enough considering the very beautiful scene. The highlight was only the...","July 30, 2018","sam_s"
"976","5.0","A WONDERFUL TOUR. This is an AMAZING tour. It gives me great pleasure to give it a stellar review. Not only was the scenery breathtaking but our bus drivers Pat and Phil and tour guide Lauren were charming, well informed and fun.\nWe took this tour at the...","July 29, 2018","ingridbtravels"
"976","5.0","Bus trip from Banff to Columbia Icefield. Our guide Louie and driver Andy were fantastic and full of information. The views and the weather were amazing. Lunch and snacks were provided and the bus was very clean and comfortable. I would recomend this trip to anyone who has not yet been. Definetly...","July 28, 2018","cesare_m"
"976","5.0","Visit to the ice theater. Our driver, Jordan, was the best, great excursion! We loved the ice theater and the historic details.","July 24, 2018","claudiaandersonb2018"
"976","5.0","Bus trip from Banff to Athabasca Glacier and Sky Walk. This trip was just beautiful! Our guide Louie and bus driver were full of information about the many lakes we stopped to see and the glaciers we saw along the way. It was a well-timed trip that lasted all day. We had a buffet lunch...","July 24, 2018","luanne57"
"976","5.0","Banff to Athabasca Glacier and back. We were on a tour with Al (Alan) as our driver and Nicola as our host. First off...Al was no BS and hysterical. It shouldn’t have been as funny as it was, but we appreciate no BS. When Al tells you we are rolling out,...","July 21, 2018","hangrylady"
"976","3.0","Once was a Glacier. As we arrived at this point from Jasper at the northern end of this magnificent 250 kilometre Parkway, there was no where to stop and look at the skywalk. Sadly this picture is very deceptive. Within a minute of us stopping to figure out where...","June 25, 2018","glenn70foodie"
"976","5.0","Amazing Glacier Opportunity. We had a great day stopping at different points between Banff and the Icefields. Our tour guide Anick was very interesting and fun! The Glacier walk was really exciting, as you never know when/if you'll get another chance to do this in the future. Highly...","May 18, 2018","jayne_m"
"977","4.0","Whistler Feb ‘19. Exhilarating snow cat ride up Blackcomb Mountain to the Crystal Chalet (takes about an hour). Most fun Fondue dinner with entertainment (thanks Randy). The ride back down intersects multiple grooming snow cats while they work.","February 28, 2019","capt_bob_257"
"977","5.0","Awesome Experience with teen kids and older parents . This was an amazing experience for our family. The views from the mountain are romantic and a beautiful backdrop. My husband and I went on the tour with my older parents and our 3 teenaged kids. None of us had ever been on a snowmobile....","February 19, 2019","243carissa"
"977","5.0","An Amazing Thing to Do While Visiting Whistler!. We had such an amazing evening at the Crystal Hut Fondue from start to finish. The 1 hour CAT ride up the hill was great, with views and very comfortable. We were very lucky to get an almost full moon dog moon and the staff...","February 19, 2019","kendralm"
"977","5.0","What a wonderful experience!. Really want to say thank you to Dan (snowcat driver) and Kyle (k2) for helping me with my special evening. Chad squeezed out an awesome (and clean) version of our favorite tenacious D song which really made dinner fun.\nThe ride up and down the...","February 7, 2019","tiowillow"
"977","5.0","Great night out. A fun trip up the mountain to a fondue dinner and entertainment by a great singer. Enjoyed every minute. Thank you to our guide Hannah.","January 10, 2019","hennighongkong"
"977","5.0","Loved our snowcat fondue adventure. We thoroughly enjoyed our snowcat fondue adventure. Our snowcat driver was so sweet and made us all feel very safe. The ride up the mountain was about 45 minutes but it was beautiful! We were surrounded by gorgeous trees covered in tons of snow!! The...","January 6, 2019","geraline_b"
"977","5.0","Fondue at 6,000 Feet. Great time on the fondue snowcat tour. A comfortable ride up Blackcomb Mountain to the smaller Crystal Hut. Makes for a more intimate setting. About 30 total people, half go up by snow mobile, half by snowcat. Servers great you with a Hot Chocolate and...","February 27, 2018","philstevanovic"
"977","5.0","Awesome Adventure . If you want to experience an awesome adventure ask for Dalton to be your guide. Dalton is your man, for top notch customer service and wants his guests to have fun... Highly recommend Dalton.","February 11, 2018","debbie_c"
"977","5.0","Absolutely Wonderful!. We got married last year and Canadian Wilderness Adventures saved our wedding by renting a snowcat to take us up the side of Blackcomb for our ceremony. We wanted to celebrate our anniversary in similar style and decided on the fondue by snowcat adventure. We...","February 5, 2018","megan_humphrey3"
"977","3.0","Long ride for a great dinner. The snowcat ride is an hour in each direction, which gets very old. There are some nice views during the ride, but not enough to make the ride seem shorter. The fondue dinner in the Crystal Hut is very good, and one of our guides...","January 20, 2018","bkek1987"
"977","5.0","Whistler Crystal Hut Delicious Fondue Dinner. Great family activity for young and old! We were transported up Blackcomb Mountain to the Crystal Hut for a delicious fondue dinner. Dinner was accompanied by a troubador with a guitar! The staff was very helpful. Dinner was served quickly and everyone had time to...","December 27, 2017","kashmax"
"977","1.0","Belinda O’Shea . Terrible! A total waste of money and time. No atmosphere, an awful fondue and disgusting wine! Very boring from start to finish!!!!\nSo disappointing!","December 26, 2017","belindao369"
"978","5.0","Liam was incredible!. It was such a beautiful morning sledding up Rainbow mountain! Liam was so friendly and made it so much fun! He gave us a thorough safety brief and made sure we understood everything clearly before we picked up speed. We stopped at some amazing viewpoints...","March 3, 2019","hburt92"
"978","5.0","Great Adventure. This was an awesome Tour.We booked the Tour at 4:30pm and got Lucky that we had our guide Liam just for the three of us .We got up the Mountain and saw a beautiful sunset and Moonrising.Liam always set up the Pace which Suited us.Totally...","February 18, 2019","rikeo379"
"978","5.0","Fantastic winter activity for adventure seekers. I went on a tour with my husband in the middle of January. The office is located in the nice small skiing village of Whistler but the tour itself starts far off from the touristy sight, which I already loved.\nThe enthusiastic young guides gave...","January 23, 2019","46malenat"
"978","5.0","Super fun!. Totally recommend. I was a little apprehensive before we started because I have ZERO riding experience. It was easy-peasy and they even took the governors off for us (we had to ask). Just wish it had been a longer ride! Next time...:)","January 18, 2019","kparks66"
